Date,Source,Number of People,Check-in Date,Check-out Date,Hotel name,Address,Room Type,Distance from attraction,Deal Info,price,Review,name,score,Review Score,Number of Reviews,Rating,Star Rating,Distance from Attraction,Location Score
2025-09-24,booking.com,2.0,2025-10-20,2025-10-23,Central Downtown Toronto - Trinity Bellwood Park,"Downtown Toronto, Toronto",Two-Room Apartment,1.4 miles from downtown,,$156,,,,,,,,,
2025-09-24,booking.com,2.0,2025-10-20,2025-10-23,Xiao Wang,"The Annex, Toronto (The Annex)",Queen Room with Garden View,1.6 miles from downtown,,$252,,,,,,,,,
2025-09-24,booking.com,2.0,2025-10-20,2025-10-23,Stunning Rooms in Townhouse across the Beach,"The Beaches, Toronto (The Beaches)",Deluxe Double Room with Bath,4 miles from downtown,,$116,,,,,,,,,
2025-09-24,booking.com,2.0,2025-10-20,2025-10-23,Classy and Luxury 2 bedroom apartment 5 mins to Dundas Square,"The Village, Toronto (The Village)",Two-Bedroom Apartment,0.5 miles from downtown,Late Escape Deal,$275,,,,,,,,,
2025-09-24,booking.com,2.0,2025-10-20,2025-10-23,Filmores Hotel,"Downtown Toronto, Toronto",Queen Room,0.6 miles from downtown,,$145,,,,,,,,,
2025-09-24,booking.com,2.0,2025-10-20,2025-10-23,Executive Corner Suite with Panoramic View,"Entertainment District, Toronto (Entertainment District)",Apartment,0.7 miles from downtown,,$470,,,,,,,,,
2025-10-07,booking.com,2.0,2025-10-10,2025-10-13,Modern Private Room Private Bathroom with King Bed with TV and Optional Balcony 10 minutes to Rogers Stadium Midtown Downtown Toronto,"North York, Toronto",Triple Room with Private Bathroom,7.5 miles from downtown,Limited-time Deal,$92,,,,,,,,,
2025-10-07,booking.com,2.0,2025-10-10,2025-10-13,W Toronto,"Bloor-Yorkville, Toronto (Bloor-Yorkville)",Deluxe King Room,1.3 miles from downtown,,$244,,,,,,,,,
2025-10-07,booking.com,2.0,2025-10-10,2025-10-13,Homewood Suites by Hilton Toronto Airport Corporate Centre,Toronto,King Studio Suite - Non-Smoking,11 miles from downtown,,$154,,,,,,,,,
2025-10-07,booking.com,2.0,2025-10-10,2025-10-13,Chelsea Hotel Toronto,"Yonge - Dundas, Toronto (Yonge - Dundas)",Standard Double Room with Two Double Beds,0.5 miles from downtown,,$187,,,,,,,,,
2025-10-07,booking.com,2.0,2025-10-10,2025-10-13,Hampton Inn & Suites by Hilton Toronto Downtown,"The Village, Toronto (The Village)",King Room,0.7 miles from downtown,,$222,,,,,,,,,
2025-10-07,booking.com,2.0,2025-10-10,2025-10-13,Holiday Inn Toronto Downtown Centre by IHG,"The Village, Toronto (The Village)",Double Room - Disability Access/Roll-In Shower,0.7 miles from downtown,,$205,,,,,,,,,
2025-10-07,booking.com,2.0,2025-10-10,2025-10-13,Yonge Suites Apart Hotel,"Yonge - Dundas, Toronto (Yonge Street)",One-Bedroom Apartment,0.2 miles from downtown,,$188,,,,,,,,,
2025-10-07,booking.com,2.0,2025-10-10,2025-10-13,The Westin Toronto Airport,"Etobicoke, Toronto (Northeast Mississauga)","Traditional, Guest room, 1 King",11.1 miles from downtown,,$159,,,,,,,,,
2025-10-07,booking.com,2.0,2025-10-10,2025-10-13,Radisson Blu Toronto Downtown,"The Harbourfront, Toronto (The Harbourfront)",King Room with City View - Non Smoking,0.9 miles from downtown,,$227,,,,,,,,,
2025-10-07,booking.com,2.0,2025-10-10,2025-10-13,Samesun Toronto,"Kensington Market, Toronto (Kensington Market)",Queen Room with Balcony,1.1 miles from downtown,,$147,,,,,,,,,
2025-10-07,booking.com,2.0,2025-10-10,2025-10-13,Canadas Best Value Inn Toronto,"Etobicoke, Toronto",Queen Room - Non-Smoking,9 miles from downtown,,$104,,,,,,,,,
2025-10-07,booking.com,2.0,2025-10-10,2025-10-13,Sheraton Centre Toronto Hotel,"Downtown Toronto, Toronto (Queen West)","Guest room, 1 Queen",0.1 miles from downtown,,$231,,,,,,,,,
2025-10-07,booking.com,2.0,2025-10-10,2025-10-13,DoubleTree by Hilton Toronto Downtown,"Downtown Toronto, Toronto",Queen Room,0.3 miles from downtown,Late Escape Deal,$168,,,,,,,,,
2025-10-07,booking.com,2.0,2025-10-10,2025-10-13,Great Canadian Casino Resort Toronto,"Etobicoke, Toronto",Premium King,11.9 miles from downtown,,$159,,,,,,,,,
2025-10-07,booking.com,2.0,2025-10-10,2025-10-13,Sandman Signature Toronto Airport Hotel,"Etobicoke, Toronto","Standard Room, 2 Queen Beds",10.7 miles from downtown,,$104,,,,,,,,,
2025-10-07,booking.com,2.0,2025-10-10,2025-10-13,Mainfloor Spacious Room in Toronto,"Scarborough, Toronto",Family Room with Private Bathroom,12.1 miles from downtown,Late Escape Deal,$94,,,,,,,,,
2025-10-07,booking.com,2.0,2025-10-10,2025-10-13,Executive Hotel Cosmopolitan Toronto,"Old Town Toronto, Toronto (Old Town Toronto)",1 Bedroom,0.3 miles from downtown,,$183,,,,,,,,,
2025-10-07,booking.com,2.0,2025-10-10,2025-10-13,Fairmont Royal York Hotel,"Financial District, Toronto (Entertainment District)",Queen Room,0.4 miles from downtown,,$296,,,,,,,,,
2025-10-07,booking.com,2.0,2025-10-10,2025-10-13,Embassy Suites By Hilton Toronto Airport,"Etobicoke, Toronto (Northeast Mississauga)",Two-Room King Suite,11 miles from downtown,,$254,,,,,,,,,
2025-10-07,booking.com,2.0,2025-10-10,2025-10-13,The Novotel Toronto Centre,"Old Town Toronto, Toronto (Old Town Toronto)",Premier Executive Room with King Bed.,0.5 miles from downtown,,$324,,,,,,,,,
2025-10-07,booking.com,2.0,2025-10-10,2025-10-13,"Hotel X Toronto, a Destination by Hyatt Hotel",Toronto,Deluxe King Room,2 miles from downtown,,$282,,,,,,,,,
2025-10-07,booking.com,2.0,2025-10-10,2025-10-13,InterContinental Toronto Centre by IHG,"Entertainment District, Toronto (Entertainment District)",Classic Room,0.5 miles from downtown,,$237,,,,,,,,,
2025-10-07,booking.com,2.0,2025-10-10,2025-10-13,SoHo Hotel Toronto,"Entertainment District, Toronto (Entertainment District)",Luxury King Room,0.7 miles from downtown,,$263,,,,,,,,,
2025-10-07,booking.com,2.0,2025-10-10,2025-10-13,Best Western Plus Travel Hotel Toronto Airport,Toronto,Queen Room,10.9 miles from downtown,,$109,,,,,,,,,
2025-10-07,booking.com,2.0,2025-10-10,2025-10-13,Hilton Toronto,"Financial District, Toronto (Financial District)",King Room,0.2 miles from downtown,,$222,,,,,,,,,
2025-10-07,booking.com,2.0,2025-10-10,2025-10-13,Holiday Inn Express Toronto Downtown by IHG,"Old Town Toronto, Toronto (Old Town Toronto)",Standard King Room,0.5 miles from downtown,,$226,,,,,,,,,
2025-10-07,booking.com,2.0,2025-10-10,2025-10-13,Gladstone House,"West Queen West, Toronto (West Queen West)",Studio Queen,2.3 miles from downtown,,$225,,,,,,,,,
2025-10-07,booking.com,2.0,2025-10-10,2025-10-13,Crowne Plaza Toronto Airport by IHG,"Etobicoke, Toronto",Standard Room,10.5 miles from downtown,,$101,,,,,,,,,
2025-10-07,booking.com,2.0,2025-10-10,2025-10-13,Town Inn Suites Hotel,"The Village, Toronto (The Village)",Deluxe King Suite,1.2 miles from downtown,,$151,,,,,,,,,
2025-10-07,booking.com,2.0,2025-10-10,2025-10-13,Stylish One Bedroom Suite - Entertainment District Toronto,"Entertainment District, Toronto (Entertainment District)",One-Bedroom Apartment,0.7 miles from downtown,,$250,,,,,,,,,
2025-10-07,booking.com,2.0,2025-10-10,2025-10-13,Novotel Toronto North York,"North York, Toronto",Superior King Room,8.2 miles from downtown,,$178,,,,,,,,,
2025-10-07,booking.com,2.0,2025-10-10,2025-10-13,The Yorkville Royal Sonesta Hotel Toronto,"The Annex, Toronto (The Annex)",Deluxe King Room,1.3 miles from downtown,,$215,,,,,,,,,
2025-10-07,booking.com,2.0,2025-10-10,2025-10-13,"Delta Suites - In Downtown Toronto, Opposite Scotiabank Arena, CN Tower, Rogers Centre & MTCC","Entertainment District, Toronto (Entertainment District)",One-Bedroom Apartment,0.6 miles from downtown,,$250,,,,,,,,,
2025-10-07,booking.com,2.0,2025-10-10,2025-10-13,Margie Townhome Suites,"The Village, Toronto (The Village)",Superior One-Bedroom Suite with External Private Bathroom,0.6 miles from downtown,,$190,,,,,,,,,
2025-10-07,booking.com,2.0,2025-10-10,2025-10-13,Canopy By Hilton Toronto Yorkville,"Downtown Toronto, Toronto",King Room,1.4 miles from downtown,,$278,,,,,,,,,
2025-10-07,booking.com,2.0,2025-10-10,2025-10-13,UofT St George Campus Penthouse,"Downtown Toronto, Toronto",One-Bedroom Apartment,1.3 miles from downtown,,$344,,,,,,,,,
2025-10-07,booking.com,2.0,2025-10-10,2025-10-13,The Beverley Hotel,"Downtown Toronto, Toronto (Entertainment District)",Deluxe Queen Suite,0.5 miles from downtown,,$238,,,,,,,,,
2025-10-07,booking.com,2.0,2025-10-10,2025-10-13,"Doubletree by Hilton Toronto Airport, ON","Etobicoke, Toronto (Northeast Mississauga)",Queen Room with Two Queen Beds,11 miles from downtown,,$146,,,,,,,,,
2025-10-07,booking.com,2.0,2025-10-10,2025-10-13,Woodbine Hotel & Suites,"Etobicoke, Toronto",Queen Room,11.3 miles from downtown,,$129,,,,,,,,,
2025-10-07,booking.com,2.0,2025-10-10,2025-10-13,Breezy Lake And City Views - One Free Underground Parking,"Downtown Toronto, Toronto",Two-Bedroom Apartment,1.1 miles from downtown,,$219,,,,,,,,,
2025-10-07,booking.com,2.0,2025-10-10,2025-10-13,Stay Inn Hotel Toronto,"Etobicoke, Toronto",Business King Room - Fully Renovated 2021,8.6 miles from downtown,,$156,,,,,,,,,
2025-10-07,booking.com,2.0,2025-10-10,2025-10-13,Delta Hotels by Marriott Toronto Airport & Conference Centre,"Etobicoke, Toronto",Double Queen Room,10.2 miles from downtown,,$152,,,,,,,,,
2025-10-07,booking.com,2.0,2025-10-10,2025-10-13,Holiday Inn Toronto Airport East by IHG,"Etobicoke, Toronto",Standard King Room,9.9 miles from downtown,,$123,,,,,,,,,
2025-10-07,booking.com,2.0,2025-10-10,2025-10-13,Hyatt Regency Toronto,"Entertainment District, Toronto (Entertainment District)",Queen Room,0.6 miles from downtown,,$257,,,,,,,,,
2025-10-07,booking.com,2.0,2025-10-10,2025-10-13,Holiday Inn Express & Suites Toronto Airport South by IHG,"Etobicoke, Toronto (Northeast Mississauga)",Standard Room with Two Queen Beds,10.5 miles from downtown,,$138,,,,,,,,,
2025-10-07,booking.com,2.0,2025-10-10,2025-10-13,"Revery Toronto Downtown, Curio Collection by Hilton","Entertainment District, Toronto (Entertainment District)",King Room,0.6 miles from downtown,,$238,,,,,,,,,
2025-10-07,booking.com,2.0,2025-10-10,2025-10-13,Core Downtown Toronto-3 Bedrooms-2 Bathrooms-Washrooms-Free Parking-CN Tower-Ripleys Museum-Blue Jays Stadium In front-Indoor Gym-Swimming Pool-Jacuzzi Sauna-Filter Drinking Water-WiFi,"Entertainment District, Toronto (Entertainment District)",Three-Bedroom Apartment,0.7 miles from downtown,,$293,,,,,,,,,
2025-10-07,booking.com,2.0,2025-10-10,2025-10-13,Warm Downtown Home,"Old Town Toronto, Toronto (Old Town Toronto)",Standard Double Room,0.5 miles from downtown,,$120,,,,,,,,,
2025-10-07,booking.com,2.0,2025-10-10,2025-10-13,"Elegant 2BR & 2BA Retreat in Prime Yorkville, Downtown","Bloor-Yorkville, Toronto (Bloor-Yorkville)",Two-Bedroom Apartment with City View,1.4 miles from downtown,,$254,,,,,,,,,
2025-10-07,booking.com,2.0,2025-10-10,2025-10-13,Queen Nest Hotel,"Downtown Toronto, Toronto",Standard Queen Room,1.3 miles from downtown,,$102,,,,,,,,,
2025-10-07,booking.com,2.0,2025-10-10,2025-10-13,Deluxe Suites at York,"Entertainment District, Toronto (Entertainment District)",One-Bedroom Apartment with City View,0.7 miles from downtown,Late Escape Deal,$203,,,,,,,,,
2025-10-07,booking.com,2.0,2025-10-10,2025-10-13,Courtyard by Marriott Toronto Airport,"Etobicoke, Toronto (Northeast Mississauga)",Queen Room with Two Queen Beds,10.9 miles from downtown,,$131,,,,,,,,,
2025-10-07,booking.com,2.0,2025-10-10,2025-10-13,Toronto Airport Marriott Hotel,"Etobicoke, Toronto",King Room,10.8 miles from downtown,,$155,,,,,,,,,
2025-10-07,booking.com,2.0,2025-10-10,2025-10-13,Union Hotel,"Financial District, Toronto (Financial District)",Queen Room,0.4 miles from downtown,,$230,,,,,,,,,
2025-10-07,booking.com,2.0,2025-10-10,2025-10-13,Ace Hotel Toronto,"Fashion District, Toronto (Fashion District)",Small Room,0.9 miles from downtown,,$257,,,,,,,,,
2025-10-07,booking.com,2.0,2025-10-10,2025-10-13,Sonder by Marriott Bonvoy The Liberty Apartments Liberty Village,Toronto,One-Bedroom Apartment with Queen Bed and Balcony,2.2 miles from downtown,,$189,,,,,,,,,
2025-10-07,booking.com,2.0,2025-10-10,2025-10-13,Toronto Marriott City Centre Hotel,"Entertainment District, Toronto (Entertainment District)","Guest room, 1 Queen",0.8 miles from downtown,,$335,,,,,,,,,
2025-10-07,booking.com,2.0,2025-10-10,2025-10-13,Toronto Don Valley Hotel and Suites,"North York, Toronto",Double Room with Two Double Beds,5.7 miles from downtown,,$131,,,,,,,,,
2025-10-07,booking.com,2.0,2025-10-10,2025-10-13,Cozy house near HWY401 & Go station in Scarborough,"Scarborough, Toronto",Three-Bedroom House,15.4 miles from downtown,,$330,,,,,,,,,
2025-10-07,booking.com,2.0,2025-10-10,2025-10-13,Toronto Stay Next To Beautiful High Park & ZOO,Toronto,Deluxe Double Room,4.5 miles from downtown,,$71,,,,,,,,,
2025-10-07,booking.com,2.0,2025-10-10,2025-10-13,586 Hotel,"Kensington Market, Toronto (Kensington Market)",Double Room,0.9 miles from downtown,,$99,,,,,,,,,
2025-10-07,booking.com,2.0,2025-10-10,2025-10-13,"The Anndore House, part of JDV by Hyatt","The Village, Toronto (The Village)",King Loft,1.2 miles from downtown,,$308,,,,,,,,,
2025-10-07,booking.com,2.0,2025-10-10,2025-10-13,Luxury Home - Upper Toronto Beaches,Toronto,Vacation Home,3.7 miles from downtown,Late Escape Deal,$414,,,,,,,,,
2025-10-07,booking.com,2.0,2025-10-10,2025-10-13,Comfort Inn & Conference Centre Toronto Airport,"Etobicoke, Toronto","1 Queen Bed, Nonsmoking",10.7 miles from downtown,,$96,,,,,,,,,
2025-10-07,booking.com,2.0,2025-10-10,2025-10-13,Le Germain Hotel Toronto,"Entertainment District, Toronto (Entertainment District)",Classic Queen Room,0.6 miles from downtown,,$296,,,,,,,,,
2025-10-07,booking.com,2.0,2025-10-10,2025-10-13,"The Westin Harbour Castle, Toronto","The Harbourfront, Toronto (The Harbourfront)","Guest room, 1 King, Lake view",0.8 miles from downtown,,$240,,,,,,,,,
2025-10-07,booking.com,2.0,2025-10-10,2025-10-13,Marriott Downtown at CF Toronto Eaton Centre,"Yonge - Dundas, Toronto (Yonge - Dundas)","Guest room, 2 Double",0.2 miles from downtown,,$250,,,,,,,,,
2025-10-07,booking.com,2.0,2025-10-10,2025-10-13,scarborough home,"Scarborough, Toronto",Double Room,11.4 miles from downtown,,"$1,577",,,,,,,,,
2025-10-07,booking.com,2.0,2025-10-10,2025-10-13,Sheraton Toronto Airport Hotel & Conference Centre,"Etobicoke, Toronto","Traditional, Guest room, 2 Queen",10.5 miles from downtown,,$146,,,,,,,,,
2025-10-07,booking.com,2.0,2025-10-10,2025-10-13,RivetStays - The Yonge,"The Harbourfront, Toronto (The Harbourfront)",One-Bedroom Apartment,0.6 miles from downtown,,$160,,,,,,,,,
2025-10-07,booking.com,2.0,2025-10-10,2025-10-13,The One,"Entertainment District, Toronto (Entertainment District)",Apartment with City View,0.7 miles from downtown,,$213,,,,,,,,,
2025-10-07,booking.com,2.0,2025-10-10,2025-10-13,Casa Queen - Unique 2BR Suite in Leslieville,"Leslieville, Toronto (Leslieville)",Suite,2.9 miles from downtown,,$198,,,,,,,,,
2025-10-07,booking.com,2.0,2025-10-10,2025-10-13,Toronto Travellers Home,"Kensington Market, Toronto (Kensington Market)",,0.9 miles from downtown,,$88,,,,,,,,,
2025-10-07,booking.com,2.0,2025-10-10,2025-10-13,"The Ellios Suites - In Downtown Toronto, Opposite CN Tower & Rogers Centre","Entertainment District, Toronto (Entertainment District)",One-Bedroom Apartment,0.7 miles from downtown,,$250,,,,,,,,,
2025-10-07,booking.com,2.0,2025-10-10,2025-10-13,Royal Oak Inn,"Cabbagetown, Toronto (Cabbagetown)",Double Room,0.8 miles from downtown,,$118,,,,,,,,,
2025-10-07,booking.com,2.0,2025-10-10,2025-10-13,EST Hotel,"Etobicoke, Toronto",Standard King Bed,13 miles from downtown,,$85,,,,,,,,,
2025-10-07,booking.com,2.0,2025-10-10,2025-10-13,Nox Hostel,"Downtown Toronto, Toronto",Twin Room with Shared Bathroom,1.3 miles from downtown,Late Escape Deal,$83,,,,,,,,,
2025-10-07,booking.com,2.0,2025-10-10,2025-10-13,Courtyard by Marriott Toronto Downtown,"The Village, Toronto (The Village)",King Room with City View,0.8 miles from downtown,,$231,,,,,,,,,
2025-10-07,booking.com,2.0,2025-10-10,2025-10-13,Dragon Gate Inn,"Downtown Toronto, Toronto",Superior Studio (2 Adults),1.3 miles from downtown,,$123,,,,,,,,,
2025-10-07,booking.com,2.0,2025-10-10,2025-10-13,Casa Hotel Elegant Suite w Patio BBQ Grill,"Leslieville, Toronto (Leslieville)",Suite,3 miles from downtown,,$235,,,,,,,,,
2025-10-07,booking.com,2.0,2025-10-10,2025-10-13,Modern Toronto Lake View & CN Tower View - One Free Parking,"The Harbourfront, Toronto (Entertainment District)",Two-Bedroom Apartment,0.6 miles from downtown,,$239,,,,,,,,,
2025-10-07,booking.com,2.0,2025-10-10,2025-10-13,Vita House near Downsview and Yorkdale Shopping Center,"North York, Toronto",Queen Room with Garden View,8.5 miles from downtown,Late Escape Deal,$103,,,,,,,,,
2025-10-07,booking.com,2.0,2025-10-10,2025-10-13,The Westlake,"Etobicoke, Toronto",Queen Suite,7 miles from downtown,,$205,,,,,,,,,
2025-10-07,booking.com,2.0,2025-10-10,2025-10-13,Modern Suite in Etobicoke - Near Airport & Downtown!,"Etobicoke, Toronto",One-Bedroom Apartment,7.2 miles from downtown,,$116,,,,,,,,,
2025-10-07,booking.com,2.0,2025-10-10,2025-10-13,Madison Manor Boutique Hotel,"The Annex, Toronto (The Annex)",Mini Suite,1.5 miles from downtown,,$241,,,,,,,,,
2025-10-07,booking.com,2.0,2025-10-10,2025-10-13,"Toor Hotel Toronto, Part Of Jdv By Hyatt","Downtown Toronto, Toronto",King Room,0.5 miles from downtown,,$221,,,,,,,,,
2025-10-07,booking.com,2.0,2025-10-10,2025-10-13,freed Suites - Downtown Toronto,"Entertainment District, Toronto (Entertainment District)",Two-Bedroom Apartment with Balcony,0.4 miles from downtown,,$336,,,,,,,,,
2025-10-07,booking.com,2.0,2025-10-10,2025-10-13,Best Western Plus Toronto North York Hotel & Suites,"North York, Toronto",Queen Room,10.3 miles from downtown,,$124,,,,,,,,,
2025-10-07,booking.com,2.0,2025-10-10,2025-10-13,Downtown Toronto 2 bedrooms with parking,"Entertainment District, Toronto (Entertainment District)",Two-Bedroom Apartment with Balcony,0.7 miles from downtown,Late Escape Deal,$215,,,,,,,,,
2025-10-07,booking.com,2.0,2025-10-10,2025-10-13,Sonder by Marriott Bonvoy Artesa Apartments West Queen West,Toronto,One-Bedroom Apartment with Double Bed and Balcony,2.4 miles from downtown,,$204,,,,,,,,,
2025-10-07,booking.com,2.0,2025-10-10,2025-10-13,The Alexandra Hotel,"Downtown Toronto, Toronto",Double and Single Bed Room,1 miles from downtown,,$128,,,,,,,,,
2025-10-07,booking.com,2.0,2025-10-10,2025-10-13,Delta Hotels by Marriott Toronto,"Entertainment District, Toronto (Entertainment District)",King Room with Lake View,0.7 miles from downtown,,$285,,,,,,,,,
2025-10-07,booking.com,2.0,2025-10-10,2025-10-13,Deluxe Inn,"Etobicoke, Toronto",Queen Room - Non-Smoking,8.2 miles from downtown,,$91,,,,,,,,,
2025-10-07,booking.com,2.0,2025-10-10,2025-10-13,Sutton Place Hotel Toronto,"Entertainment District, Toronto (Entertainment District)",Accessible Room - 1 King Bed,0.7 miles from downtown,,$218,,,,,,,,,
2025-10-07,booking.com,2.0,2025-10-10,2025-10-13,Park Hyatt Toronto,"The Annex, Toronto (The Annex)",King Room,1.4 miles from downtown,,$597,,,,,,,,,
2025-10-07,booking.com,2.0,2025-10-10,2025-10-13,Luxurious Suite in Yorkville,"Bloor-Yorkville, Toronto (Bloor-Yorkville)",Two-Bedroom Apartment,1.4 miles from downtown,,$189,,,,,,,,,
2025-10-07,booking.com,2.0,2025-10-10,2025-10-13,The Parkdale Cottage,Toronto,Two-Bedroom House,2.7 miles from downtown,,$259,,,,,,,,,
2025-10-07,booking.com,2.0,2025-10-10,2025-10-13,Gorgeous Condo in Downtown Near CN Tower,"Entertainment District, Toronto (Entertainment District)",One-Bedroom Apartment,0.6 miles from downtown,,$177,,,,,,,,,
2025-10-07,booking.com,2.0,2025-10-10,2025-10-13,Yorkville Condo near STK,"Bloor-Yorkville, Toronto (Bloor-Yorkville)",One-Bedroom Apartment with Garden View,1.4 miles from downtown,,$168,,,,,,,,,
2025-10-07,booking.com,2.0,2025-10-10,2025-10-13,Holiday Inn Express Toronto-North York by IHG,"North York, Toronto",Standard King Room,10.2 miles from downtown,,$132,,,,,,,,,
2025-10-07,booking.com,2.0,2025-10-10,2025-10-13,Downtown Toronto Condo CN Tower,"The Harbourfront, Toronto (Entertainment District)",One-Bedroom Apartment,0.7 miles from downtown,Late Escape Deal,$143,,,,,,,,,
2025-10-07,booking.com,2.0,2025-10-10,2025-10-13,Pantages Hotel Toronto Centre,"Yonge - Dundas, Toronto (Yonge - Dundas)",Deluxe King Room,0.2 miles from downtown,,$197,,,,,,,,,
2025-10-07,booking.com,2.0,2025-10-10,2025-10-13,Cozy Room in a Quiet Neighbourhood,"Scarborough, Toronto",Double Room with Shared Bathroom,13.7 miles from downtown,,$63,,,,,,,,,
2025-10-07,booking.com,2.0,2025-10-10,2025-10-13,Village at York U,"North York, Toronto",Deluxe Double Room,9.8 miles from downtown,,$90,,,,,,,,,
2025-10-07,booking.com,2.0,2025-10-10,2025-10-13,Pleasant 1BR Sofa Bed Close to UofT,"Downtown Toronto, Toronto",Apartment with Balcony,0.9 miles from downtown,,$182,,,,,,,,,
2025-10-07,booking.com,2.0,2025-10-10,2025-10-13,TononHouse,"North York, Toronto",Queen Room,9.2 miles from downtown,Limited-time Deal,$58,,,,,,,,,
2025-10-07,booking.com,2.0,2025-10-10,2025-10-13,"Spacious 2 Bedroom plus Den, 2 Bath, Sleeps 5 with Balcony and Lakeview Downtown Toronto Condo","Downtown Toronto, Toronto",Three-Bedroom Apartment,1.6 miles from downtown,,$494,,,,,,,,,
2025-10-07,booking.com,2.0,2025-10-10,2025-10-13,Chic 1-BR Condo; Parking included; Downtown Core,"Entertainment District, Toronto (Entertainment District)",One-Bedroom Apartment,0.7 miles from downtown,,$366,,,,,,,,,
2025-10-07,booking.com,2.0,2025-10-10,2025-10-13,Residence Inn by Marriott Toronto Downtown / Entertainment District,"Entertainment District, Toronto (Entertainment District)",King Studio with Sofa Bed,0.7 miles from downtown,,$223,,,,,,,,,
2025-10-07,booking.com,2.0,2025-10-10,2025-10-13,Stylish Condo Downtown Near CN Tower - Free parking,"Downtown Toronto, Toronto",One-Bedroom Apartment,1.1 miles from downtown,,$261,,,,,,,,,
2025-10-07,booking.com,2.0,2025-10-10,2025-10-13,Le Germain Hotel Maple Leaf Square,"Entertainment District, Toronto (Entertainment District)",Classic King Room,0.6 miles from downtown,,$284,,,,,,,,,
2025-10-07,booking.com,2.0,2025-10-10,2025-10-13,Downtown Luxury Victorian Retreat,"Cabbagetown, Toronto (Cabbagetown)",Deluxe Queen Room with Garden View,0.8 miles from downtown,,$260,,,,,,,,,
2025-10-07,booking.com,2.0,2025-10-10,2025-10-13,Designer One Bedroom Suite - Entertainment District Toronto,"Entertainment District, Toronto (Entertainment District)",One-Bedroom Apartment,0.4 miles from downtown,,$250,,,,,,,,,
2025-10-07,booking.com,2.0,2025-10-10,2025-10-13,Two BD CN Tower and Lake Ontario View,"Entertainment District, Toronto (Entertainment District)",Two-Bedroom Apartment,0.7 miles from downtown,,$346,,,,,,,,,
2025-10-07,booking.com,2.0,2025-10-10,2025-10-13,"BISHA, a Luxury Collection Hotel, Toronto","Entertainment District, Toronto (Entertainment District)",The Nina King Room with City View,0.7 miles from downtown,,$377,,,,,,,,,
2025-10-07,booking.com,2.0,2025-10-10,2025-10-13,Carlton House,"Cabbagetown, Toronto (Cabbagetown)",Queen Room,1.3 miles from downtown,,$123,,,,,,,,,
2025-10-07,booking.com,2.0,2025-10-10,2025-10-13,Lilen's Home,"Scarborough, Toronto",Family Room with Private Bathroom,8.2 miles from downtown,,$181,,,,,,,,,
2025-10-07,booking.com,2.0,2025-10-10,2025-10-13,Toronto Bloor & Yonge Luxury Condo,"The Village, Toronto (The Village)",One-Bedroom Apartment,1 miles from downtown,,$193,,,,,,,,,
2025-10-07,booking.com,2.0,2025-10-10,2025-10-13,New custom-built house in Toronto,"North York, Toronto",Three-Bedroom House,6.3 miles from downtown,,$301,,,,,,,,,
2025-10-07,booking.com,2.0,2025-10-10,2025-10-13,Filmores Hotel,"Downtown Toronto, Toronto",Queen Room,0.6 miles from downtown,,$153,,,,,,,,,
2025-10-07,booking.com,2.0,2025-10-10,2025-10-13,Metropolis Loft - CN Tower,"Entertainment District, Toronto (Entertainment District)",One-Bedroom Suite,0.6 miles from downtown,,$198,,,,,,,,,
2025-10-07,booking.com,2.0,2025-10-10,2025-10-13,The Broadview Hotel,Toronto,King Room,1.7 miles from downtown,,$344,,,,,,,,,
2025-10-07,booking.com,2.0,2025-10-10,2025-10-13,"CN Tower View with Free Parking, Pool, Gym, Free Skating, and More","Downtown Toronto, Toronto",One-Bedroom Apartment,1.5 miles from downtown,,$242,,,,,,,,,
2025-10-07,booking.com,2.0,2025-10-10,2025-10-13,Relax in East York Space Share,Toronto,Double Room with Shared Bathroom,3.5 miles from downtown,,$37,,,,,,,,,
2025-10-07,booking.com,2.0,2025-10-10,2025-10-13,"Toronto Downtown Core Two Bedroom Condo with CN Tower View, Free Parking","Entertainment District, Toronto (Entertainment District)",Two-Bedroom Apartment with City View,0.6 miles from downtown,,$248,,,,,,,,,
2025-10-07,booking.com,2.0,2025-10-10,2025-10-13,Bedroom in Corso Italia Neighborhood,Toronto,Apartment,4.1 miles from downtown,,$103,,,,,,,,,
2025-10-07,booking.com,2.0,2025-10-10,2025-10-13,Lum The Queen,Toronto,Two-Bedroom Suite,1.7 miles from downtown,,$232,,,,,,,,,
2025-10-07,booking.com,2.0,2025-10-10,2025-10-13,SkySide Downtown Condo - Free Parking,"Downtown Toronto, Toronto",One-Bedroom Apartment,1.5 miles from downtown,,$226,,,,,,,,,
2025-10-07,booking.com,2.0,2025-10-10,2025-10-13,Mins from Toronto Downtown UFT Exhibition Place,Toronto,Two-Bedroom Apartment,2.9 miles from downtown,,$242,,,,,,,,,
2025-10-07,booking.com,2.0,2025-10-10,2025-10-13,Nobu Hotel Toronto,"Entertainment District, Toronto (Entertainment District)",Deluxe King Room,0.6 miles from downtown,,$679,,,,,,,,,
2025-10-07,booking.com,2.0,2025-10-10,2025-10-13,Idlewood Inn,"Scarborough, Toronto",Suite,11.9 miles from downtown,,$90,,,,,,,,,
2025-10-07,booking.com,2.0,2025-10-10,2025-10-13,SoHo Residences Toronto,"Entertainment District, Toronto (Entertainment District)",Studio Apartment,0.7 miles from downtown,,$358,,,,,,,,,
2025-10-07,booking.com,2.0,2025-10-10,2025-10-13,Super Cosy Peaceful room with Garden view free Parking,"Etobicoke, Toronto",Double Room with Garden View,9.7 miles from downtown,,$52,,,,,,,,,
