Date,Source,Number of People,Check-in Date,Check-out Date,Hotel name,Address,Room Type,Distance from attraction,Deal Info,price_usd,Distance from Attraction,price_cad,booking_lead_time,length_of_stay,day_of_week,month,week_of_year,is_weekend,district
2025-09-25,booking.com,2.0,2025-10-15,2025-10-18,A Home Away-Deluxe Guest Room in Toronto,"North York, Toronto",Queen Room,9.5,,60,,83.4,20,3,Wednesday,October,42,True,North York
2025-09-25,booking.com,2.0,2025-10-15,2025-10-18,EST Hotel,"Etobicoke, Toronto",Standard one Queen bed,13.0,,160,,222.4,20,3,Wednesday,October,42,True,Etobicoke
2025-09-25,booking.com,2.0,2025-10-15,2025-10-18,Warm Downtown Home,"Old Town Toronto, Toronto (Old Town Toronto)",Standard Double Room,0.5,Late Escape Deal,111,,154.29,20,3,Wednesday,October,42,True,Old Town
2025-09-25,booking.com,2.0,2025-10-15,2025-10-18,Kimpton Saint George Hotel by IHG,"The Annex, Toronto (The Annex)",Premium King Room - High Floor,1.4,,385,,535.15,20,3,Wednesday,October,42,True,The Annex
2025-09-25,booking.com,2.0,2025-10-15,2025-10-18,Modern Private Room Private Bathroom with King Bed with TV and Optional Balcony 10 minutes to Rogers Stadium Midtown Downtown Toronto,"North York, Toronto",Triple Room with Private Bathroom,7.5,,106,,147.34,20,3,Wednesday,October,42,True,North York
2025-09-25,booking.com,2.0,2025-10-15,2025-10-18,"The Anndore House, part of JDV by Hyatt","The Village, Toronto (The Village)",Queen Room with Two Queen Beds - High Floor,1.2,,418,,581.02,20,3,Wednesday,October,42,True,The Village
2025-09-25,booking.com,2.0,2025-10-15,2025-10-18,586 Hotel,"Kensington Market, Toronto (Kensington Market)",Double Room,0.9,,122,,169.58,20,3,Wednesday,October,42,True,Kensington Market
2025-09-25,booking.com,2.0,2025-10-15,2025-10-18,Stay Inn Hotel Toronto,"Etobicoke, Toronto",Business King Room - Fully Renovated 2021,8.6,,151,,209.89,20,3,Wednesday,October,42,True,Etobicoke
2025-09-25,booking.com,2.0,2025-10-15,2025-10-18,Comfort Inn & Conference Centre Toronto Airport,"Etobicoke, Toronto",Standard King Room,10.7,,109,,151.51,20,3,Wednesday,October,42,True,Etobicoke
2025-09-25,booking.com,2.0,2025-10-15,2025-10-18,Toronto Travellers Home,"Kensington Market, Toronto (Kensington Market)",,0.9,,88,,122.32,20,3,Wednesday,October,42,True,Kensington Market
2025-09-25,booking.com,2.0,2025-10-15,2025-10-18,Falstaff Home,Toronto,Junior Suite,7.3,,75,,104.25,20,3,Wednesday,October,42,True,
2025-09-25,booking.com,2.0,2025-10-15,2025-10-18,Super 8 by Wyndham Toronto East ON,"Scarborough, Toronto",Queen Room - Smoking,9.7,,104,,144.56,20,3,Wednesday,October,42,True,Scarborough
2025-09-25,booking.com,2.0,2025-10-15,2025-10-18,Four Seasons Hotel Toronto,"Bloor-Yorkville, Toronto (Bloor-Yorkville)",Premier King Room,1.4,,835,,1160.65,20,3,Wednesday,October,42,True,Bloor-Yorkville
2025-09-25,booking.com,2.0,2025-10-15,2025-10-18,1 Hotel Toronto,"Fashion District, Toronto (Fashion District)",King Room with Balcony,1.2,,631,,877.09,20,3,Wednesday,October,42,True,Fashion District
2025-09-25,booking.com,2.0,2025-10-15,2025-10-18,Luxury Spacious 3 Bedrooms Trinity Bellwoods,Toronto,Apartment,2.2,,279,,387.81,20,3,Wednesday,October,42,True,
2025-09-25,booking.com,2.0,2025-10-15,2025-10-18,Dragon Gate Inn,"Downtown Toronto, Toronto",Superior Studio (2 Adults),1.3,,124,,172.36,20,3,Wednesday,October,42,True,Downtown Toronto
2025-09-25,booking.com,2.0,2025-10-15,2025-10-18,Courtyard by Marriott Toronto Downtown,"The Village, Toronto (The Village)",King Room with City View,0.8,,246,,341.94,20,3,Wednesday,October,42,True,The Village
2025-09-25,booking.com,2.0,2025-10-15,2025-10-18,Designer One Bedroom Suite - Entertainment District Toronto,"Entertainment District, Toronto (Entertainment District)",One-Bedroom Apartment,0.4,,287,,398.93,20,3,Wednesday,October,42,True,Entertainment District
2025-09-25,booking.com,2.0,2025-10-15,2025-10-18,Nox Hostel,"Downtown Toronto, Toronto",Double Room with Shared Bathroom,1.3,Late Escape Deal,84,,116.76,20,3,Wednesday,October,42,True,Downtown Toronto
2025-09-25,booking.com,2.0,2025-10-15,2025-10-18,freed Suites - Downtown Toronto,"Entertainment District, Toronto (Entertainment District)",Two-Bedroom Apartment with Balcony,0.4,,338,,469.82,20,3,Wednesday,October,42,True,Entertainment District
2025-09-25,booking.com,2.0,2025-10-15,2025-10-18,Royal Oak Inn,"Cabbagetown, Toronto (Cabbagetown)",Double Room,0.8,,119,,165.41,20,3,Wednesday,October,42,True,Cabbagetown
2025-09-25,booking.com,2.0,2025-10-15,2025-10-18,Lakeview Condo in Downtown with Free Parking.,"Downtown Toronto, Toronto",Two-Bedroom Apartment,1.5,,324,,450.36,20,3,Wednesday,October,42,True,Downtown Toronto
2025-09-25,booking.com,2.0,2025-10-15,2025-10-18,The Westin Toronto Airport,"Etobicoke, Toronto (Northeast Mississauga)","Traditional, Guest room, 1 King",11.1,,186,,258.54,20,3,Wednesday,October,42,True,Northeast Mississauga
2025-09-25,booking.com,2.0,2025-10-15,2025-10-18,Designer 3Br & 2WR Townhouse,Toronto,Three-Bedroom Apartment,3.4,,287,,398.93,20,3,Wednesday,October,42,True,
2025-09-25,booking.com,2.0,2025-10-15,2025-10-18,Hotel Victoria,"Financial District, Toronto (Financial District)",Deluxe King Room,0.3,,305,,423.95,20,3,Wednesday,October,42,True,Financial District
2025-09-25,booking.com,2.0,2025-10-15,2025-10-18,Pantages Hotel Toronto Centre,"Yonge - Dundas, Toronto (Yonge - Dundas)",City King Room,0.2,,277,,385.03,20,3,Wednesday,October,42,True,Yonge - Dundas
2025-09-25,booking.com,2.0,2025-10-15,2025-10-18,"The Ellios Suites - In Downtown Toronto, Opposite CN Tower & Rogers Centre","Entertainment District, Toronto (Entertainment District)",One-Bedroom Apartment,0.7,,251,,348.89,20,3,Wednesday,October,42,True,Entertainment District
2025-09-25,booking.com,2.0,2025-10-15,2025-10-18,Stylish Condo Downtown Near CN Tower - Free parking,"Downtown Toronto, Toronto",One-Bedroom Apartment,1.1,,276,,383.64,20,3,Wednesday,October,42,True,Downtown Toronto
2025-09-25,booking.com,2.0,2025-10-15,2025-10-18,Modern Toronto Lake View & CN Tower View - One Free Parking,"The Harbourfront, Toronto (Entertainment District)",Two-Bedroom Apartment,0.6,Late Escape Deal,288,,400.32,20,3,Wednesday,October,42,True,Entertainment District
2025-09-25,booking.com,2.0,2025-10-15,2025-10-18,Queen bedroom,"Etobicoke, Toronto",Queen Room,10.5,,52,,72.28,20,3,Wednesday,October,42,True,Etobicoke
2025-09-25,booking.com,2.0,2025-10-15,2025-10-18,Two BD CN Tower and Lake Ontario View,"Entertainment District, Toronto (Entertainment District)",Two-Bedroom Apartment,0.7,,336,,467.04,20,3,Wednesday,October,42,True,Entertainment District
2025-09-25,booking.com,2.0,2025-10-15,2025-10-18,Luxury Home - Upper Toronto Beaches,Toronto,Holiday Home,3.7,Late Escape Deal,465,,646.35,20,3,Wednesday,October,42,True,
2025-09-25,booking.com,2.0,2025-10-15,2025-10-18,Deluxe Inn,"Etobicoke, Toronto",Queen Room - Non-Smoking,8.2,,95,,132.05,20,3,Wednesday,October,42,True,Etobicoke
2025-09-25,booking.com,2.0,2025-10-15,2025-10-18,Madison Manor Boutique Hotel,"The Annex, Toronto (The Annex)",King or Queen Room,1.5,,201,,279.39,20,3,Wednesday,October,42,True,The Annex
2025-09-25,booking.com,2.0,2025-10-15,2025-10-18,Belarte Suites - Downtown Toronto - CN Tower & Rogers Centre,"Entertainment District, Toronto (Entertainment District)",Three-Bedroom Apartment,0.7,,719,,999.41,20,3,Wednesday,October,42,True,Entertainment District
2025-09-25,booking.com,2.0,2025-10-15,2025-10-18,The Westlake,"Etobicoke, Toronto",Queen Suite,7.0,,214,,297.46,20,3,Wednesday,October,42,True,Etobicoke
2025-09-25,booking.com,2.0,2025-10-15,2025-10-18,Park Hyatt Toronto,"The Annex, Toronto (The Annex)",One-Bedroom Deluxe Corner Suite - High Floor,1.4,,1142,,1587.38,20,3,Wednesday,October,42,True,The Annex
2025-09-25,booking.com,2.0,2025-10-15,2025-10-18,Urban Explore,"Downtown Toronto, Toronto",Superior Suite,0.7,,312,,433.68,20,3,Wednesday,October,42,True,Downtown Toronto
2025-09-25,booking.com,2.0,2025-10-15,2025-10-18,9mins airport 1 min to shopping mall,"Etobicoke, Toronto",Small Double Room,9.6,,45,,62.55,20,3,Wednesday,October,42,True,Etobicoke
2025-09-25,booking.com,2.0,2025-10-15,2025-10-18,Delta Hotels by Marriott Toronto,"Entertainment District, Toronto (Entertainment District)",Queen Room with Two Queen Beds,0.7,,424,,589.36,20,3,Wednesday,October,42,True,Entertainment District
2025-09-25,booking.com,2.0,2025-10-15,2025-10-18,The Omni King Edward Hotel,"Old Town Toronto, Toronto (Old Town Toronto)",Premier Room - 1 King Bed,0.3,,558,,775.62,20,3,Wednesday,October,42,True,Old Town
2025-09-25,booking.com,2.0,2025-10-15,2025-10-18,"Large Downtown 2Br condo with Parking steps to Eaton Centre, UofT and SickKids","Downtown Toronto, Toronto",Two-Bedroom Apartment,0.6,,248,,344.72,20,3,Wednesday,October,42,True,Downtown Toronto
2025-09-25,booking.com,2.0,2025-10-15,2025-10-18,RivetStays - The Jarvis,"Downtown Toronto, Toronto",Royal Apartment,0.5,,204,,283.56,20,3,Wednesday,October,42,True,Downtown Toronto
2025-09-25,booking.com,2.0,2025-10-15,2025-10-18,Luxury Basement-Private Bdr & Bathroom with free parking In Toronto,"Etobicoke, Toronto",Superior Queen Room,12.5,,57,,79.23,20,3,Wednesday,October,42,True,Etobicoke
2025-09-25,booking.com,2.0,2025-10-15,2025-10-18,Best Western Plus Toronto North York Hotel & Suites,"North York, Toronto",Queen Room,10.3,,125,,173.75,20,3,Wednesday,October,42,True,North York
2025-09-21,booking.com,2.0,2025-10-03,2025-10-06,Modern Private Room Private Bathroom with King Bed with TV and Optional Balcony 10 minutes to Rogers Stadium Midtown Downtown Toronto,"North York, Toronto",Triple Room with Private Bathroom,,Limited-time Deal,98,7.5,136.22,8,3,Friday,October,40,True,North York
2025-09-21,booking.com,2.0,2025-10-03,2025-10-06,"The Slate Hotel Downtown, Sonder by Marriott Bonvoy","Entertainment District, Toronto (Entertainment District)",Queen Room,,,278,0.7,386.42,8,3,Friday,October,40,True,Entertainment District
2025-09-21,booking.com,2.0,2025-10-03,2025-10-06,Riu Plaza Toronto,"Entertainment District, Toronto (Entertainment District)",Deluxe Double or Twin Room,,,261,0.6,362.79,8,3,Friday,October,40,True,Entertainment District
2025-09-21,booking.com,2.0,2025-10-03,2025-10-06,Crowne Plaza Toronto Airport by IHG,"Etobicoke, Toronto",Standard Room,,,116,10.5,161.24,8,3,Friday,October,40,True,Etobicoke
2025-09-21,booking.com,2.0,2025-10-03,2025-10-06,Chelsea Hotel Toronto,"Yonge - Dundas, Toronto (Yonge - Dundas)",Standard Double Room with Two Double Beds,,,203,0.5,282.17,8,3,Friday,October,40,True,Yonge - Dundas
2025-09-21,booking.com,2.0,2025-10-03,2025-10-06,Samesun Toronto,"Kensington Market, Toronto (Kensington Market)",Queen Room with Balcony,,,147,1.1,204.33,8,3,Friday,October,40,True,Kensington Market
2025-09-21,booking.com,2.0,2025-10-03,2025-10-06,One King West Hotel and Residence,"Financial District, Toronto (Financial District)",Tower Deluxe Suite,,,266,0.3,369.74,8,3,Friday,October,40,True,Financial District
2025-09-21,booking.com,2.0,2025-10-03,2025-10-06,Town Inn Suites Hotel,"The Village, Toronto (The Village)",Deluxe King Suite,,,169,1.2,234.91,8,3,Friday,October,40,True,The Village
2025-09-21,booking.com,2.0,2025-10-03,2025-10-06,Holiday Inn Toronto Downtown Centre by IHG,"The Village, Toronto (The Village)",Standard Double Room with Two Double Beds,,,243,0.7,337.77,8,3,Friday,October,40,True,The Village
2025-09-21,booking.com,2.0,2025-10-03,2025-10-06,DoubleTree by Hilton Toronto Downtown,"Downtown Toronto, Toronto",King Room,,,305,0.3,423.95,8,3,Friday,October,40,True,Downtown Toronto
2025-09-21,booking.com,2.0,2025-10-03,2025-10-06,Hampton Inn by Hilton Toronto Airport Corporate Centre,Toronto,Room with Two Queen Beds - Non-Smoking,,,119,11.0,165.41,8,3,Friday,October,40,True,
2025-09-21,booking.com,2.0,2025-10-03,2025-10-06,Pan Pacific Toronto,"North York, Toronto",Deluxe Room King Bed,,,109,7.3,151.51,8,3,Friday,October,40,True,North York
2025-09-21,booking.com,2.0,2025-10-03,2025-10-06,Canadas Best Value Inn Toronto,"Etobicoke, Toronto",Queen Room - Non-Smoking,,,106,9.0,147.34,8,3,Friday,October,40,True,Etobicoke
2025-09-21,booking.com,2.0,2025-10-03,2025-10-06,Executive Hotel Cosmopolitan Toronto,"Old Town Toronto, Toronto (Old Town Toronto)",Junior Suite - CN Tower View,,,285,0.3,396.15,8,3,Friday,October,40,True,Old Town
2025-09-21,booking.com,2.0,2025-10-03,2025-10-06,Sheraton Centre Toronto Hotel,"Downtown Toronto, Toronto (Queen West)","Guest room, 1 Queen",,,321,0.1,446.19,8,3,Friday,October,40,True,Queen West
2025-09-21,booking.com,2.0,2025-10-03,2025-10-06,Sandman Signature Toronto Airport Hotel,"Etobicoke, Toronto","Standard Room, 2 Queen Beds",,,126,10.7,175.14,8,3,Friday,October,40,True,Etobicoke
2025-09-21,booking.com,2.0,2025-10-03,2025-10-06,Holiday Inn Toronto International Airport by IHG,"Etobicoke, Toronto (Northeast Mississauga)",Standard Room,,,123,11.2,170.97,8,3,Friday,October,40,True,Northeast Mississauga
2025-09-21,booking.com,2.0,2025-10-03,2025-10-06,Homewood Suites by Hilton Toronto Airport Corporate Centre,Toronto,King Studio Suite - Non-Smoking,,,137,11.0,190.43,8,3,Friday,October,40,True,
2025-09-21,booking.com,2.0,2025-10-03,2025-10-06,Great Canadian Casino Resort Toronto,"Etobicoke, Toronto",Racetrack King,,,215,11.9,298.85,8,3,Friday,October,40,True,Etobicoke
2025-09-21,booking.com,2.0,2025-10-03,2025-10-06,"Delta Suites - In Downtown Toronto, Opposite Scotiabank Arena, CN Tower, Rogers Centre & MTCC","Entertainment District, Toronto (Entertainment District)",One-Bedroom Apartment,,,278,0.6,386.42,8,3,Friday,October,40,True,Entertainment District
2025-09-21,booking.com,2.0,2025-10-03,2025-10-06,Stylish One Bedroom Suite - Entertainment District Toronto,"Entertainment District, Toronto (Entertainment District)",One-Bedroom Apartment,,,253,0.7,351.67,8,3,Friday,October,40,True,Entertainment District
2025-09-21,booking.com,2.0,2025-10-03,2025-10-06,Fairmont Royal York Hotel,"Financial District, Toronto (Entertainment District)",Queen Room,,,408,0.4,567.12,8,3,Friday,October,40,True,Entertainment District
2025-09-21,booking.com,2.0,2025-10-03,2025-10-06,Best Western Plus Travel Hotel Toronto Airport,Toronto,Queen Room,,,126,10.9,175.14,8,3,Friday,October,40,True,
2025-09-21,booking.com,2.0,2025-10-03,2025-10-06,Gladstone House,"West Queen West, Toronto (West Queen West)",Studio Queen,,,335,2.3,465.65,8,3,Friday,October,40,True,West Queen West
2025-09-21,booking.com,2.0,2025-10-03,2025-10-06,Embassy Suites By Hilton Toronto Airport,"Etobicoke, Toronto (Northeast Mississauga)",Two-Room King Suite,,,147,11.0,204.33,8,3,Friday,October,40,True,Northeast Mississauga
2025-09-21,booking.com,2.0,2025-10-03,2025-10-06,The Novotel Toronto Centre,"Old Town Toronto, Toronto (Old Town Toronto)",Superior with Two Queen Beds - Renovated,,,389,0.5,540.71,8,3,Friday,October,40,True,Old Town
2025-09-21,booking.com,2.0,2025-10-03,2025-10-06,SoHo Hotel Toronto,"Entertainment District, Toronto (Entertainment District)",Luxury King Room,,,305,0.7,423.95,8,3,Friday,October,40,True,Entertainment District
2025-09-21,booking.com,2.0,2025-10-03,2025-10-06,Breezy Lake And City Views - One Free Underground Parking,"Downtown Toronto, Toronto",Three-Bedroom Apartment,,,278,1.1,386.42,8,3,Friday,October,40,True,Downtown Toronto
2025-09-21,booking.com,2.0,2025-10-03,2025-10-06,"Hotel X Toronto, a Destination by Hyatt Hotel",Toronto,Deluxe King Room,,,393,2.0,546.27,8,3,Friday,October,40,True,
2025-09-21,booking.com,2.0,2025-10-03,2025-10-06,Canopy By Hilton Toronto Yorkville,"Downtown Toronto, Toronto",King Room,,,243,1.4,337.77,8,3,Friday,October,40,True,Downtown Toronto
2025-09-21,booking.com,2.0,2025-10-03,2025-10-06,InterContinental Toronto Centre by IHG,"Entertainment District, Toronto (Entertainment District)",Classic Room,,,357,0.5,496.23,8,3,Friday,October,40,True,Entertainment District
2025-09-21,booking.com,2.0,2025-10-03,2025-10-06,Novotel Toronto North York,"North York, Toronto",Executive King Room with Sofa Bed,,,224,8.2,311.36,8,3,Friday,October,40,True,North York
2025-09-21,booking.com,2.0,2025-10-03,2025-10-06,Holiday Inn Express Toronto Downtown by IHG,"Old Town Toronto, Toronto (Old Town Toronto)",Standard King Room,,,387,0.5,537.93,8,3,Friday,October,40,True,Old Town
2025-09-21,booking.com,2.0,2025-10-03,2025-10-06,Hilton Toronto,"Financial District, Toronto (Financial District)",Queen Room with Two Queen Beds,,,296,0.2,411.44,8,3,Friday,October,40,True,Financial District
2025-09-21,booking.com,2.0,2025-10-03,2025-10-06,KozyStay Toronto,"North York, Toronto",Three-Bedroom House,,,206,9.0,286.34,8,3,Friday,October,40,True,North York
2025-09-21,booking.com,2.0,2025-10-03,2025-10-06,"Doubletree by Hilton Toronto Airport, ON","Etobicoke, Toronto (Northeast Mississauga)",Queen Room with Two Queen Beds,,,129,11.0,179.31,8,3,Friday,October,40,True,Northeast Mississauga
2025-09-21,booking.com,2.0,2025-10-03,2025-10-06,The Parkdale Hostellerie,Toronto,Apartment with Terrace,,,95,2.6,132.05,8,3,Friday,October,40,True,
2025-09-21,booking.com,2.0,2025-10-03,2025-10-06,Woodbine Hotel & Suites,"Etobicoke, Toronto",King Room,,,111,11.3,154.29,8,3,Friday,October,40,True,Etobicoke
2025-09-21,booking.com,2.0,2025-10-03,2025-10-06,Holiday Inn Express & Suites Toronto Airport South by IHG,"Etobicoke, Toronto (Northeast Mississauga)",Standard King Room with Mobility Accessible Tub,,,150,10.5,208.5,8,3,Friday,October,40,True,Northeast Mississauga
2025-09-21,booking.com,2.0,2025-10-03,2025-10-06,Delta Hotels by Marriott Toronto Airport & Conference Centre,"Etobicoke, Toronto",King Guest Room,,,147,10.2,204.33,8,3,Friday,October,40,True,Etobicoke
2025-09-21,booking.com,2.0,2025-10-03,2025-10-06,W Toronto,"Bloor-Yorkville, Toronto (Bloor-Yorkville)",Deluxe King Room,,,270,1.3,375.3,8,3,Friday,October,40,True,Bloor-Yorkville
2025-09-21,booking.com,2.0,2025-10-03,2025-10-06,Adas Guesthouse,"Downtown Toronto, Toronto",Standard Queen Room,,,110,1.3,152.9,8,3,Friday,October,40,True,Downtown Toronto
2025-09-21,booking.com,2.0,2025-10-03,2025-10-06,Holiday Inn Toronto Airport East by IHG,"Etobicoke, Toronto",Standard King Room,,,129,9.9,179.31,8,3,Friday,October,40,True,Etobicoke
2025-09-21,booking.com,2.0,2025-10-03,2025-10-06,Union Hotel,"Financial District, Toronto (Financial District)",Queen Room,,,305,0.4,423.95,8,3,Friday,October,40,True,Financial District
2025-09-21,booking.com,2.0,2025-10-03,2025-10-06,Ace Hotel Toronto,"Fashion District, Toronto (Fashion District)",Queen Room,,,306,0.9,425.34,8,3,Friday,October,40,True,Fashion District
2025-09-21,booking.com,2.0,2025-10-03,2025-10-06,Hampton Inn & Suites by Hilton Toronto Downtown,"The Village, Toronto (The Village)",King Room,,,275,0.7,382.25,8,3,Friday,October,40,True,The Village
2025-09-21,booking.com,2.0,2025-10-03,2025-10-06,Parc Suites - Entertainment District Toronto,"Entertainment District, Toronto (Entertainment District)",One-Bedroom Apartment,,,253,0.4,351.67,8,3,Friday,October,40,True,Entertainment District
2025-09-21,booking.com,2.0,2025-10-03,2025-10-06,Toronto Marriott City Centre Hotel,"Entertainment District, Toronto (Entertainment District)","Concierge level, Guest room, 1 King, City view",,,555,0.8,771.45,8,3,Friday,October,40,True,Entertainment District
2025-09-21,booking.com,2.0,2025-10-03,2025-10-06,SkyHigh Haven LED-Lit Downtown Condo Retreat,"Downtown Toronto, Toronto",Two-Bedroom Apartment,,,143,1.1,198.77,8,3,Friday,October,40,True,Downtown Toronto
2025-09-21,booking.com,2.0,2025-10-03,2025-10-06,Hyatt Regency Toronto,"Entertainment District, Toronto (Entertainment District)",Queen Room,,,371,0.6,515.69,8,3,Friday,October,40,True,Entertainment District
2025-09-21,booking.com,2.0,2025-10-03,2025-10-06,Old Mill Toronto Hotel,"Etobicoke, Toronto",Basic Queen Room,,,236,5.5,328.04,8,3,Friday,October,40,True,Etobicoke
2025-09-21,booking.com,2.0,2025-10-03,2025-10-06,Yorkville Plaza Suites - Pool & Hot Tub,"Bloor-Yorkville, Toronto (Bloor-Yorkville)",Two-Bedroom Apartment,,,435,1.4,604.65,8,3,Friday,October,40,True,Bloor-Yorkville
2025-09-21,booking.com,2.0,2025-10-03,2025-10-06,Kimpton Saint George Hotel by IHG,"The Annex, Toronto (The Annex)",Queen Room with Two Queen Beds,,,280,1.4,389.2,8,3,Friday,October,40,True,The Annex
2025-09-21,booking.com,2.0,2025-10-03,2025-10-06,Sheraton Toronto Airport Hotel & Conference Centre,"Etobicoke, Toronto","Traditional, Guest room, 2 Queen",,,165,10.5,229.35,8,3,Friday,October,40,True,Etobicoke
2025-09-21,booking.com,2.0,2025-10-03,2025-10-06,EST Hotel,"Etobicoke, Toronto",Standard one Queen bed,,,165,13.0,229.35,8,3,Friday,October,40,True,Etobicoke
2025-09-21,booking.com,2.0,2025-10-03,2025-10-06,Toronto Don Valley Hotel and Suites,"North York, Toronto",Double Room with Two Double Beds,,,132,5.7,183.48,8,3,Friday,October,40,True,North York
2025-09-21,booking.com,2.0,2025-10-03,2025-10-06,Stylish City Escape,"Etobicoke, Toronto",Deluxe Double Room,,,59,6.0,82.01,8,3,Friday,October,40,True,Etobicoke
2025-09-21,booking.com,2.0,2025-10-03,2025-10-06,"Revery Toronto Downtown, Curio Collection by Hilton","Entertainment District, Toronto (Entertainment District)",King Room,,,269,0.6,373.91,8,3,Friday,October,40,True,Entertainment District
2025-09-21,booking.com,2.0,2025-10-03,2025-10-06,Residence Inn by Marriott Toronto Airport,"Etobicoke, Toronto",King or Queen Suite with Sofa Bed,,,174,10.6,241.86,8,3,Friday,October,40,True,Etobicoke
2025-09-21,booking.com,2.0,2025-10-03,2025-10-06,Warm Downtown Home,"Old Town Toronto, Toronto (Old Town Toronto)",Standard Double Room,,,129,0.5,179.31,8,3,Friday,October,40,True,Old Town
2025-09-21,booking.com,2.0,2025-10-03,2025-10-06,Falstaff Home,Toronto,Double Room,,,83,7.3,115.37,8,3,Friday,October,40,True,
2025-09-21,booking.com,2.0,2025-10-03,2025-10-06,Comfort Inn & Conference Centre Toronto Airport,"Etobicoke, Toronto",Queen Room with Two Queen Beds,,,111,10.7,154.29,8,3,Friday,October,40,True,Etobicoke
2025-09-21,booking.com,2.0,2025-10-03,2025-10-06,"The Westin Harbour Castle, Toronto","The Harbourfront, Toronto (The Harbourfront)",Premium Queen Room with Two Queen Beds and Lake View,,,374,0.8,519.86,8,3,Friday,October,40,True,The Harbourfront
2025-09-21,booking.com,2.0,2025-10-03,2025-10-06,Le Germain Hotel Toronto,"Entertainment District, Toronto (Entertainment District)",Classic Queen Room,,,294,0.6,408.66,8,3,Friday,October,40,True,Entertainment District
2025-09-21,booking.com,2.0,2025-10-03,2025-10-06,"The Anndore House, part of JDV by Hyatt","The Village, Toronto (The Village)",Queen Loft,,,375,1.2,521.25,8,3,Friday,October,40,True,The Village
2025-09-21,booking.com,2.0,2025-10-03,2025-10-06,Dragon Gate Inn,"Downtown Toronto, Toronto",Superior Studio 2 Bed,,,162,1.3,225.18,8,3,Friday,October,40,True,Downtown Toronto
2025-09-21,booking.com,2.0,2025-10-03,2025-10-06,Stay Inn Hotel Toronto,"Etobicoke, Toronto",Business King Room - Fully Renovated 2021,,,174,8.6,241.86,8,3,Friday,October,40,True,Etobicoke
2025-09-21,booking.com,2.0,2025-10-03,2025-10-06,The Westin Toronto Airport,"Etobicoke, Toronto (Northeast Mississauga)","Traditional, Guest room, 1 King",,,155,11.1,215.45,8,3,Friday,October,40,True,Northeast Mississauga
2025-09-21,booking.com,2.0,2025-10-03,2025-10-06,Deluxe Suites at York,"Entertainment District, Toronto (Entertainment District)",Two-Bedroom Apartment with Harbor View,,Late Escape Deal,247,0.7,343.33,8,3,Friday,October,40,True,Entertainment District
2025-09-21,booking.com,2.0,2025-10-03,2025-10-06,Super 8 by Wyndham Toronto East ON,"Scarborough, Toronto",Queen Room - Non-Smoking,,,106,9.7,147.34,8,3,Friday,October,40,True,Scarborough
2025-09-21,booking.com,2.0,2025-10-03,2025-10-06,Toronto Travellers Home,"Kensington Market, Toronto (Kensington Market)",Double Room,,,130,0.9,180.7,8,3,Friday,October,40,True,Kensington Market
2025-09-21,booking.com,2.0,2025-10-03,2025-10-06,Dream Catcher Travel House,Toronto,Double Room with Private Bathroom,,,102,2.0,141.78,8,3,Friday,October,40,True,
2025-09-21,booking.com,2.0,2025-10-03,2025-10-06,freed Suites - Downtown Toronto,"Entertainment District, Toronto (Entertainment District)",Two-Bedroom Apartment with Balcony,,,340,0.4,472.6,8,3,Friday,October,40,True,Entertainment District
2025-09-21,booking.com,2.0,2025-10-03,2025-10-06,Nox Hostel,"Downtown Toronto, Toronto",Double Room with Shared Bathroom,,,105,1.3,145.95,8,3,Friday,October,40,True,Downtown Toronto
2025-09-21,booking.com,2.0,2025-10-03,2025-10-06,1 Hotel Toronto,"Fashion District, Toronto (Fashion District)",Studio King,,,355,1.2,493.45,8,3,Friday,October,40,True,Fashion District
2025-09-21,booking.com,2.0,2025-10-03,2025-10-06,Royal Oak Inn,"Cabbagetown, Toronto (Cabbagetown)",Double Room,,,144,0.8,200.16,8,3,Friday,October,40,True,Cabbagetown
2025-09-21,booking.com,2.0,2025-10-03,2025-10-06,"The Ellios Suites - In Downtown Toronto, Opposite CN Tower & Rogers Centre","Entertainment District, Toronto (Entertainment District)",One-Bedroom Apartment,,,278,0.7,386.42,8,3,Friday,October,40,True,Entertainment District
2025-09-21,booking.com,2.0,2025-10-03,2025-10-06,The Roland Peaceful 2BR Suite Near Downtown Toronto,"Old Town Toronto, Toronto (Old Town Toronto)",Suite,,,214,1.3,297.46,8,3,Friday,October,40,True,Old Town
2025-09-21,booking.com,2.0,2025-10-03,2025-10-06,Upgraded Rooms with Bath 7-min to Subway Near Downsview Rogers Stadium,"North York, Toronto",Deluxe Double Room with Bath,,,112,7.7,155.68,8,3,Friday,October,40,True,North York
2025-09-21,booking.com,2.0,2025-10-03,2025-10-06,Belarte Suites - Downtown Toronto - CN Tower & Rogers Centre,"Entertainment District, Toronto (Entertainment District)",Three-Bedroom Apartment,,,798,0.7,1109.22,8,3,Friday,October,40,True,Entertainment District
2025-09-21,booking.com,2.0,2025-10-03,2025-10-06,Luxury Basement-Private Bdr & Bathroom with free parking In Toronto,"Etobicoke, Toronto",Superior Queen Room,,,57,12.5,79.23,8,3,Friday,October,40,True,Etobicoke
