Date,Source,Number of People,Check-in Date,Check-out Date,Hotel name,Address,Room Type,Distance from attraction,Deal Info,price,Review,name,score,Review Score,Number of Reviews,Rating,Star Rating,Distance from Attraction,Location Score
2025-10-02,booking.com,2.0,2025-10-10,2025-10-13,Riu Plaza Toronto,"Entertainment District, Toronto (Entertainment District)",Deluxe Double Room with Two Double Beds,0.6 miles from downtown,,$176,,,,,,,,,
2025-10-02,booking.com,2.0,2025-10-10,2025-10-13,Sonder by Marriott Bonvoy The Liberty Apartments Liberty Village,Toronto,One-Bedroom Apartment with Queen Bed and Balcony,2.2 miles from downtown,,$189,,,,,,,,,
2025-10-02,booking.com,2.0,2025-10-10,2025-10-13,Chelsea Hotel Toronto,"Yonge - Dundas, Toronto (Yonge - Dundas)",Standard Double Room with Two Double Beds,0.5 miles from downtown,,$182,,,,,,,,,
2025-10-02,booking.com,2.0,2025-10-10,2025-10-13,One King West Hotel and Residence,"Financial District, Toronto (Financial District)",Historic Studio Suite,0.3 miles from downtown,Free airport taxi,$189,,,,,,,,,
2025-10-02,booking.com,2.0,2025-10-10,2025-10-13,Samesun Toronto,"Kensington Market, Toronto (Kensington Market)",Queen Room with Balcony,1.1 miles from downtown,,$144,,,,,,,,,
2025-10-02,booking.com,2.0,2025-10-10,2025-10-13,Holiday Inn Toronto Downtown Centre by IHG,"The Village, Toronto (The Village)",Standard Double Room with Two Double Beds,0.7 miles from downtown,,$219,,,,,,,,,
2025-10-02,booking.com,2.0,2025-10-10,2025-10-13,Radisson Blu Toronto Downtown,"The Harbourfront, Toronto (The Harbourfront)",King Room with City View - Non Smoking,0.9 miles from downtown,,$187,,,,,,,,,
2025-10-02,booking.com,2.0,2025-10-10,2025-10-13,Town Inn Suites Hotel,"The Village, Toronto (The Village)",Deluxe Suite,1.2 miles from downtown,,$148,,,,,,,,,
2025-10-02,booking.com,2.0,2025-10-10,2025-10-13,Homewood Suites by Hilton Toronto Airport Corporate Centre,Toronto,King Studio Suite - Non-Smoking,11 miles from downtown,,$145,,,,,,,,,
2025-10-02,booking.com,2.0,2025-10-10,2025-10-13,DoubleTree by Hilton Toronto Downtown,"Downtown Toronto, Toronto",Queen Room,0.3 miles from downtown,,$226,,,,,,,,,
2025-10-02,booking.com,2.0,2025-10-10,2025-10-13,Great Canadian Casino Resort Toronto,"Etobicoke, Toronto",Premium King,11.9 miles from downtown,,$111,,,,,,,,,
2025-10-02,booking.com,2.0,2025-10-10,2025-10-13,Sandman Signature Toronto Airport Hotel,"Etobicoke, Toronto","Standard Room, 2 Queen Beds",10.7 miles from downtown,,$122,,,,,,,,,
2025-10-02,booking.com,2.0,2025-10-10,2025-10-13,Sheraton Centre Toronto Hotel,"Downtown Toronto, Toronto (Queen West)","Guest room, 1 Queen",0.1 miles from downtown,,$231,,,,,,,,,
2025-10-02,booking.com,2.0,2025-10-10,2025-10-13,Executive Hotel Cosmopolitan Toronto,"Old Town Toronto, Toronto (Old Town Toronto)",1 Bedroom,0.3 miles from downtown,,$180,,,,,,,,,
2025-10-02,booking.com,2.0,2025-10-10,2025-10-13,Holiday Inn Toronto International Airport by IHG,"Etobicoke, Toronto (Northeast Mississauga)",Standard Room,11.2 miles from downtown,,$102,,,,,,,,,
2025-10-02,booking.com,2.0,2025-10-10,2025-10-13,"Hotel X Toronto, a Destination by Hyatt Hotel",Toronto,King Room with Lake View,2 miles from downtown,,$275,,,,,,,,,
2025-10-02,booking.com,2.0,2025-10-10,2025-10-13,Embassy Suites By Hilton Toronto Airport,"Etobicoke, Toronto (Northeast Mississauga)",Two-Room King Suite,11 miles from downtown,,$250,,,,,,,,,
2025-10-02,booking.com,2.0,2025-10-10,2025-10-13,Fairmont Royal York Hotel,"Financial District, Toronto (Entertainment District)",Queen Room,0.4 miles from downtown,,$312,,,,,,,,,
2025-10-02,booking.com,2.0,2025-10-10,2025-10-13,The Novotel Toronto Centre,"Old Town Toronto, Toronto (Old Town Toronto)",Premier Executive Room with King Bed.,0.5 miles from downtown,,$281,,,,,,,,,
2025-10-02,booking.com,2.0,2025-10-10,2025-10-13,Best Western Plus Travel Hotel Toronto Airport,Toronto,Queen Room,10.9 miles from downtown,,$114,,,,,,,,,
2025-10-02,booking.com,2.0,2025-10-10,2025-10-13,InterContinental Toronto Centre by IHG,"Entertainment District, Toronto (Entertainment District)",Classic King Room,0.5 miles from downtown,,$231,,,,,,,,,
2025-10-02,booking.com,2.0,2025-10-10,2025-10-13,Hilton Toronto,"Financial District, Toronto (Financial District)",King Room,0.2 miles from downtown,,$197,,,,,,,,,
2025-10-02,booking.com,2.0,2025-10-10,2025-10-13,Gladstone House,"West Queen West, Toronto (West Queen West)",Studio Queen,2.3 miles from downtown,Free airport taxi,$223,,,,,,,,,
2025-10-02,booking.com,2.0,2025-10-10,2025-10-13,SoHo Hotel Toronto,"Entertainment District, Toronto (Entertainment District)",Luxury King Room,0.7 miles from downtown,Free airport taxi,$268,,,,,,,,,
2025-10-02,booking.com,2.0,2025-10-10,2025-10-13,Holiday Inn Express Toronto Downtown by IHG,"Old Town Toronto, Toronto (Old Town Toronto)",Standard King Room with Roll-In Shower - Communications Access,0.5 miles from downtown,,$224,,,,,,,,,
2025-10-02,booking.com,2.0,2025-10-10,2025-10-13,Crowne Plaza Toronto Airport by IHG,"Etobicoke, Toronto",Standard Queen Room with Roll-In Shower - Disability Access,10.5 miles from downtown,,$97,,,,,,,,,
2025-10-02,booking.com,2.0,2025-10-10,2025-10-13,The Yorkville Royal Sonesta Hotel Toronto,"The Annex, Toronto (The Annex)",Deluxe King Room,1.3 miles from downtown,Free airport taxi,$209,,,,,,,,,
2025-10-02,booking.com,2.0,2025-10-10,2025-10-13,Novotel Toronto North York,"North York, Toronto",Superior King Room,8.2 miles from downtown,,$187,,,,,,,,,
2025-10-02,booking.com,2.0,2025-10-10,2025-10-13,"Delta Suites - In Downtown Toronto, Opposite Scotiabank Arena, CN Tower, Rogers Centre & MTCC","Entertainment District, Toronto (Entertainment District)",One-Bedroom Apartment,0.6 miles from downtown,Free airport taxi,$250,,,,,,,,,
2025-10-02,booking.com,2.0,2025-10-10,2025-10-13,Toronto Midtown Home Suites,Toronto,Double Room,3.6 miles from downtown,,$89,,,,,,,,,
2025-10-02,booking.com,2.0,2025-10-10,2025-10-13,Canopy By Hilton Toronto Yorkville,"Downtown Toronto, Toronto",King Room,1.4 miles from downtown,,$213,,,,,,,,,
2025-10-02,booking.com,2.0,2025-10-10,2025-10-13,Margie Townhome Suites,"The Village, Toronto (The Village)",Superior One-Bedroom Suite with External Private Bathroom,0.6 miles from downtown,,$176,,,,,,,,,
2025-10-02,booking.com,2.0,2025-10-10,2025-10-13,The Parkdale Hostellerie,Toronto,Apartment with Terrace,2.6 miles from downtown,,$108,,,,,,,,,
2025-10-02,booking.com,2.0,2025-10-10,2025-10-13,Delta Hotels by Marriott Toronto Airport & Conference Centre,"Etobicoke, Toronto",Double Queen Room,10.2 miles from downtown,,$124,,,,,,,,,
2025-10-02,booking.com,2.0,2025-10-10,2025-10-13,Holiday Inn Toronto Airport East by IHG,"Etobicoke, Toronto",Standard King Room,9.9 miles from downtown,,$120,,,,,,,,,
2025-10-02,booking.com,2.0,2025-10-10,2025-10-13,"Doubletree by Hilton Toronto Airport, ON","Etobicoke, Toronto (Northeast Mississauga)",Queen Room with Two Queen Beds,11 miles from downtown,,$125,,,,,,,,,
2025-10-02,booking.com,2.0,2025-10-10,2025-10-13,Breezy Lake And City Views - One Free Underground Parking,"Downtown Toronto, Toronto",Two-Bedroom Apartment,1.1 miles from downtown,Free airport taxi,$363,,,,,,,,,
2025-10-02,booking.com,2.0,2025-10-10,2025-10-13,Woodbine Hotel & Suites,"Etobicoke, Toronto",Queen Room,11.3 miles from downtown,,$129,,,,,,,,,
2025-10-02,booking.com,2.0,2025-10-10,2025-10-13,Holiday Inn Express & Suites Toronto Airport South by IHG,"Etobicoke, Toronto (Northeast Mississauga)",Standard King Room with Mobility Accessible Tub,10.5 miles from downtown,,$130,,,,,,,,,
2025-10-02,booking.com,2.0,2025-10-10,2025-10-13,Hampton Inn & Suites by Hilton Toronto Downtown,"The Village, Toronto (The Village)",Queen Room wih Two Queen Beds,0.7 miles from downtown,,$182,,,,,,,,,
2025-10-02,booking.com,2.0,2025-10-10,2025-10-13,Hyatt Regency Toronto,"Entertainment District, Toronto (Entertainment District)",Double Room with Two Double Beds,0.6 miles from downtown,,$219,,,,,,,,,
2025-10-02,booking.com,2.0,2025-10-10,2025-10-13,Courtyard by Marriott Toronto Airport,"Etobicoke, Toronto (Northeast Mississauga)",Queen Room with Two Queen Beds,10.9 miles from downtown,,$118,,,,,,,,,
2025-10-02,booking.com,2.0,2025-10-10,2025-10-13,"Revery Toronto Downtown, Curio Collection by Hilton","Entertainment District, Toronto (Entertainment District)",King Room,0.6 miles from downtown,,$198,,,,,,,,,
2025-10-02,booking.com,2.0,2025-10-10,2025-10-13,Ace Hotel Toronto,"Fashion District, Toronto (Fashion District)",Small Room,0.9 miles from downtown,Free airport taxi,$253,,,,,,,,,
2025-10-02,booking.com,2.0,2025-10-10,2025-10-13,Union Hotel,"Financial District, Toronto (Financial District)",Queen Room,0.4 miles from downtown,Free airport taxi,$230,,,,,,,,,
2025-10-02,booking.com,2.0,2025-10-10,2025-10-13,B Hotel,Toronto,Deluxe Suite,2.7 miles from downtown,,$154,,,,,,,,,
2025-10-02,booking.com,2.0,2025-10-10,2025-10-13,Deluxe Suites at York,"Entertainment District, Toronto (Entertainment District)",One-Bedroom Apartment with City View,0.7 miles from downtown,Free airport taxi,$213,,,,,,,,,
2025-10-02,booking.com,2.0,2025-10-10,2025-10-13,W Toronto,"Bloor-Yorkville, Toronto (Bloor-Yorkville)",Deluxe King Room,1.3 miles from downtown,,$245,,,,,,,,,
2025-10-02,booking.com,2.0,2025-10-10,2025-10-13,Toronto Marriott City Centre Hotel,"Entertainment District, Toronto (Entertainment District)","Guest room, 1 Queen",0.8 miles from downtown,,$430,,,,,,,,,
2025-10-02,booking.com,2.0,2025-10-10,2025-10-13,Modern Toronto Lake View & CN Tower View - One Free Parking,"The Harbourfront, Toronto (Entertainment District)",Two-Bedroom Apartment,0.6 miles from downtown,Free airport taxi,$299,,,,,,,,,
2025-10-02,booking.com,2.0,2025-10-10,2025-10-13,586 Hotel,"Kensington Market, Toronto (Kensington Market)",Double Room,0.9 miles from downtown,,$117,,,,,,,,,
2025-10-02,booking.com,2.0,2025-10-10,2025-10-13,Downtown Toronto Condo CN Tower,"The Harbourfront, Toronto (Entertainment District)",One-Bedroom Apartment,0.7 miles from downtown,Free airport taxi,$208,,,,,,,,,
2025-10-02,booking.com,2.0,2025-10-10,2025-10-13,Upscale 1 Bed & Den Downtown Toronto,"Downtown Toronto, Toronto",Two-Bedroom Apartment,1.2 miles from downtown,,$151,,,,,,,,,
2025-10-02,booking.com,2.0,2025-10-10,2025-10-13,Warm Downtown Home,"Old Town Toronto, Toronto (Old Town Toronto)",Standard Double Room,0.5 miles from downtown,,$126,,,,,,,,,
2025-10-02,booking.com,2.0,2025-10-10,2025-10-13,"The Anndore House, part of JDV by Hyatt","The Village, Toronto (The Village)",Queen Loft,1.2 miles from downtown,,$286,,,,,,,,,
2025-10-02,booking.com,2.0,2025-10-10,2025-10-13,Luxury Home - Upper Toronto Beaches,Toronto,Vacation Home,3.7 miles from downtown,Free airport taxi,$381,,,,,,,,,
2025-10-02,booking.com,2.0,2025-10-10,2025-10-13,EST Hotel,"Etobicoke, Toronto",Standard one Queen bed,13 miles from downtown,,$128,,,,,,,,,
2025-10-02,booking.com,2.0,2025-10-10,2025-10-13,Modern Private Room Private Bathroom with King Bed with TV and Optional Balcony 10 minutes to Rogers Stadium Midtown Downtown Toronto,"North York, Toronto",Triple Room with Private Bathroom,7.5 miles from downtown,,$118,,,,,,,,,
2025-10-02,booking.com,2.0,2025-10-10,2025-10-13,Comfort Inn & Conference Centre Toronto Airport,"Etobicoke, Toronto",Standard King Room,10.7 miles from downtown,,$97,,,,,,,,,
2025-10-02,booking.com,2.0,2025-10-10,2025-10-13,Sheraton Toronto Airport Hotel & Conference Centre,"Etobicoke, Toronto","Traditional, Guest room, 2 Queen",10.5 miles from downtown,,$139,,,,,,,,,
2025-10-02,booking.com,2.0,2025-10-10,2025-10-13,Core Downtown Toronto-3 Bedrooms-2 Bathrooms-Washrooms-Free Parking-CN Tower-Ripleys Museum-Blue Jays Stadium In front-Indoor Gym-Swimming Pool-Jacuzzi Sauna-Filter Drinking Water-WiFi,"Entertainment District, Toronto (Entertainment District)",Three-Bedroom Apartment,0.7 miles from downtown,Free airport taxi,$355,,,,,,,,,
2025-10-02,booking.com,2.0,2025-10-10,2025-10-13,Le Germain Hotel Toronto,"Entertainment District, Toronto (Entertainment District)",Deluxe King Room,0.6 miles from downtown,Free airport taxi,$294,,,,,,,,,
2025-10-02,booking.com,2.0,2025-10-10,2025-10-13,Toronto Travellers Home,"Kensington Market, Toronto (Kensington Market)",,0.9 miles from downtown,,$109,,,,,,,,,
2025-10-02,booking.com,2.0,2025-10-10,2025-10-13,"The Westin Harbour Castle, Toronto","The Harbourfront, Toronto (The Harbourfront)","Guest room, 1 King, Lake view",0.8 miles from downtown,,$238,,,,,,,,,
2025-10-02,booking.com,2.0,2025-10-10,2025-10-13,Kimpton Saint George Hotel by IHG,"The Annex, Toronto (The Annex)",Premium King Room - High Floor,1.4 miles from downtown,,$273,,,,,,,,,
2025-10-02,booking.com,2.0,2025-10-10,2025-10-13,Stay Inn Hotel Toronto,"Etobicoke, Toronto",Business King Room - Fully Renovated 2021,8.6 miles from downtown,,$156,,,,,,,,,
2025-10-02,booking.com,2.0,2025-10-10,2025-10-13,Dragon Gate Inn,"Downtown Toronto, Toronto",Superior Studio (2 Adults),1.3 miles from downtown,,$123,,,,,,,,,
2025-10-02,booking.com,2.0,2025-10-10,2025-10-13,1 Hotel Toronto,"Fashion District, Toronto (Fashion District)",Studio King,1.2 miles from downtown,Free airport taxi,$353,,,,,,,,,
2025-10-02,booking.com,2.0,2025-10-10,2025-10-13,Courtyard by Marriott Toronto Downtown,"The Village, Toronto (The Village)",King Room with City View,0.8 miles from downtown,,$236,,,,,,,,,
2025-10-02,booking.com,2.0,2025-10-10,2025-10-13,The Westin Toronto Airport,"Etobicoke, Toronto (Northeast Mississauga)","Traditional, Guest room, 1 King",11.1 miles from downtown,,$133,,,,,,,,,
2025-10-02,booking.com,2.0,2025-10-10,2025-10-13,Super 8 by Wyndham Toronto East ON,"Scarborough, Toronto",Queen Room - Smoking,9.7 miles from downtown,,$92,,,,,,,,,
2025-10-02,booking.com,2.0,2025-10-10,2025-10-13,Casa St Clair Hotel 1BR Basement Suite with Private Patio,Toronto,Suite,3.1 miles from downtown,Late Escape Deal,$123,,,,,,,,,
2025-10-02,booking.com,2.0,2025-10-10,2025-10-13,Designer One Bedroom Suite - Entertainment District Toronto,"Entertainment District, Toronto (Entertainment District)",One-Bedroom Apartment,0.4 miles from downtown,Free airport taxi,$250,,,,,,,,,
2025-10-02,booking.com,2.0,2025-10-10,2025-10-13,The Rex Hotel Jazz & Blues Bar,"Downtown Toronto, Toronto (Queen West)",Standard Room with Double Bed and Private Bathroom,0.3 miles from downtown,,$145,,,,,,,,,
2025-10-02,booking.com,2.0,2025-10-10,2025-10-13,Stylish Cozy Studio Condo Downtown,"The Village, Toronto (The Village)",Apartment,0.5 miles from downtown,,$169,,,,,,,,,
2025-10-02,booking.com,2.0,2025-10-10,2025-10-13,Hotel Victoria,"Financial District, Toronto (Financial District)",Standard Queen Room,0.3 miles from downtown,Free airport taxi,$200,,,,,,,,,
2025-10-02,booking.com,2.0,2025-10-10,2025-10-13,Pantages Hotel Toronto Centre,"Yonge - Dundas, Toronto (Yonge - Dundas)",Deluxe King Room,0.2 miles from downtown,Free airport taxi,$196,,,,,,,,,
2025-10-02,booking.com,2.0,2025-10-10,2025-10-13,"The Ellios Suites - In Downtown Toronto, Opposite CN Tower & Rogers Centre","Entertainment District, Toronto (Entertainment District)",One-Bedroom Apartment,0.7 miles from downtown,Free airport taxi,$250,,,,,,,,,
2025-10-02,booking.com,2.0,2025-10-10,2025-10-13,Modern Suite in Etobicoke - Near Airport & Downtown!,"Etobicoke, Toronto",One-Bedroom Apartment,7.2 miles from downtown,,$129,,,,,,,,,
2025-10-02,booking.com,2.0,2025-10-10,2025-10-13,Residence Inn by Marriott Toronto Airport,"Etobicoke, Toronto",King or Queen Suite with Sofa Bed,10.6 miles from downtown,,$178,,,,,,,,,
2025-10-02,booking.com,2.0,2025-10-10,2025-10-13,The One,"Entertainment District, Toronto (Entertainment District)",Deluxe One-Bedroom Apartment,0.7 miles from downtown,,$174,,,,,,,,,
2025-10-02,booking.com,2.0,2025-10-10,2025-10-13,Sonder by Marriott Bonvoy Artesa Apartments West Queen West,Toronto,One-Bedroom Apartment with Double Bed and Balcony,2.4 miles from downtown,,$204,,,,,,,,,
2025-10-02,booking.com,2.0,2025-10-10,2025-10-13,freed Suites - Downtown Toronto,"Entertainment District, Toronto (Entertainment District)",Two-Bedroom Apartment with Balcony,0.4 miles from downtown,Free airport taxi,$334,,,,,,,,,
2025-10-02,booking.com,2.0,2025-10-10,2025-10-13,The Omni King Edward Hotel,"Old Town Toronto, Toronto (Old Town Toronto)",Deluxe Room - 1 Queen Bed,0.3 miles from downtown,Free airport taxi,$241,,,,,,,,,
2025-10-02,booking.com,2.0,2025-10-10,2025-10-13,Madison Manor Boutique Hotel,"The Annex, Toronto (The Annex)",Partner offer option,1.5 miles from downtown,Free airport taxi,$190,,,,,,,,,
2025-10-02,booking.com,2.0,2025-10-10,2025-10-13,The Westlake,"Etobicoke, Toronto",Queen Suite,7 miles from downtown,Free airport taxi,$205,,,,,,,,,
2025-10-02,booking.com,2.0,2025-10-10,2025-10-13,Park Hyatt Toronto,"The Annex, Toronto (The Annex)",King Room,1.4 miles from downtown,,$538,,,,,,,,,
2025-10-02,booking.com,2.0,2025-10-10,2025-10-13,Hazelton Suites - Yorkville - Indoor Pool & Hot Tub,"Bloor-Yorkville, Toronto (Bloor-Yorkville)",Apartment with View and Balcony,1.4 miles from downtown,Free airport taxi,$669,,,,,,,,,
2025-10-02,booking.com,2.0,2025-10-10,2025-10-13,The Alexandra Hotel,"Downtown Toronto, Toronto",Double and Single Bed Room,1 miles from downtown,,$138,,,,,,,,,
2025-10-02,booking.com,2.0,2025-10-10,2025-10-13,Marriott Downtown at CF Toronto Eaton Centre,"Yonge - Dundas, Toronto (Yonge - Dundas)","Guest room, 2 Double",0.2 miles from downtown,,$250,,,,,,,,,
2025-10-02,booking.com,2.0,2025-10-10,2025-10-13,Deluxe Inn,"Etobicoke, Toronto",Queen Room - Non-Smoking,8.2 miles from downtown,,$89,,,,,,,,,
2025-10-02,booking.com,2.0,2025-10-10,2025-10-13,Nobu Suites - Toronto's Entertainment District,"Entertainment District, Toronto (Entertainment District)",Two-Bedroom Apartment,0.4 miles from downtown,Free airport taxi,$308,,,,,,,,,
2025-10-02,booking.com,2.0,2025-10-10,2025-10-13,Stylish Condos Toronto,"Entertainment District, Toronto (Entertainment District)",Two-Bedroom Apartment,0.7 miles from downtown,Free airport taxi,$303,,,,,,,,,
2025-10-02,booking.com,2.0,2025-10-10,2025-10-13,Yonge Suites Apart Hotel,"Yonge - Dundas, Toronto (Yonge Street)",One-Bedroom Apartment with Partial City View,0.2 miles from downtown,Free airport taxi,$202,,,,,,,,,
2025-10-02,booking.com,2.0,2025-10-10,2025-10-13,"Large Downtown 2Br condo with Parking steps to Eaton Centre, UofT and SickKids","Downtown Toronto, Toronto",Two-Bedroom Apartment,0.6 miles from downtown,Free airport taxi,$253,,,,,,,,,
2025-10-02,booking.com,2.0,2025-10-10,2025-10-13,Downtown Toronto 2 bedrooms with parking,"Entertainment District, Toronto (Entertainment District)",Two-Bedroom Apartment with Balcony,0.7 miles from downtown,Free airport taxi,$265,,,,,,,,,
2025-10-02,booking.com,2.0,2025-10-10,2025-10-13,Delta Hotels by Marriott Toronto,"Entertainment District, Toronto (Entertainment District)",King Room,0.7 miles from downtown,,$272,,,,,,,,,
2025-10-02,booking.com,2.0,2025-10-10,2025-10-13,Gorgeous Condo in Downtown Near CN Tower,"Entertainment District, Toronto (Entertainment District)",One-Bedroom Apartment,0.6 miles from downtown,,$177,,,,,,,,,
2025-10-02,booking.com,2.0,2025-10-10,2025-10-13,Sutton Place Hotel Toronto,"Entertainment District, Toronto (Entertainment District)",Accessible Room - 1 King Bed,0.7 miles from downtown,Free airport taxi,$214,,,,,,,,,
2025-10-02,booking.com,2.0,2025-10-10,2025-10-13,The Hazelton Hotel,"Bloor-Yorkville, Toronto (Bloor-Yorkville)","Deluxe Room, 1 King Bed, Balcony",1.4 miles from downtown,Free airport taxi,$790,,,,,,,,,
2025-10-02,booking.com,2.0,2025-10-10,2025-10-13,Holiday Inn Express Toronto-North York by IHG,"North York, Toronto",Standard King Room,10.2 miles from downtown,,$142,,,,,,,,,
2025-10-02,booking.com,2.0,2025-10-10,2025-10-13,Best Western Premier Toronto Airport Carlingview Hotel,"Etobicoke, Toronto (Northeast Mississauga)",King Room - Non-Smoking/Shower Only,10.7 miles from downtown,,$108,,,,,,,,,
2025-10-02,booking.com,2.0,2025-10-10,2025-10-13,Modern Downtown Condo Free Parking Pool Balcony Walk to Lake,"Downtown Toronto, Toronto",One-Bedroom Apartment,1.6 miles from downtown,Free airport taxi,$243,,,,,,,,,
2025-10-02,booking.com,2.0,2025-10-10,2025-10-13,TononHouse,"North York, Toronto",Queen Room,9.2 miles from downtown,Late Escape Deal,$69,,,,,,,,,
2025-10-02,booking.com,2.0,2025-10-10,2025-10-13,"Toor Hotel Toronto, Part Of Jdv By Hyatt","Downtown Toronto, Toronto",King Room,0.5 miles from downtown,,$198,,,,,,,,,
2025-10-02,booking.com,2.0,2025-10-10,2025-10-13,Lovely 1-Bedroom New Apartment Downtown,Toronto,One-Bedroom Apartment,2.2 miles from downtown,Late Escape Deal,$138,,,,,,,,,
2025-10-02,booking.com,2.0,2025-10-10,2025-10-13,La TUMU,"The Village, Toronto (The Village)",Deluxe King Studio,0.9 miles from downtown,Free airport taxi,$205,,,,,,,,,
2025-10-02,booking.com,2.0,2025-10-10,2025-10-13,Chic 1-BR Condo; Parking included; Downtown Core,"Entertainment District, Toronto (Entertainment District)",One-Bedroom Apartment,0.7 miles from downtown,Free airport taxi,$366,,,,,,,,,
2025-10-02,booking.com,2.0,2025-10-10,2025-10-13,Montecassino Hotel & Event Centre,"North York, Toronto",Partner offer option,8.6 miles from downtown,,$130,,,,,,,,,
2025-10-02,booking.com,2.0,2025-10-10,2025-10-13,Two BD CN Tower and Lake Ontario View,"Entertainment District, Toronto (Entertainment District)",Two-Bedroom Apartment,0.7 miles from downtown,Free airport taxi,$347,,,,,,,,,
2025-10-02,booking.com,2.0,2025-10-10,2025-10-13,"Spacious 2 Bedroom plus Den, 2 Bath, Sleeps 5 with Balcony and Lakeview Downtown Toronto Condo","Downtown Toronto, Toronto",Three-Bedroom Apartment,1.6 miles from downtown,Free airport taxi,$495,,,,,,,,,
2025-10-02,booking.com,2.0,2025-10-10,2025-10-13,"Spacious Room with Ensuite Bathroom near Subway, Koreatown & UofT","Downtown Toronto, Toronto",Superior Queen Room,1.8 miles from downtown,,$131,,,,,,,,,
2025-10-02,booking.com,2.0,2025-10-10,2025-10-13,Beautiful Luxurious Modern Condo With Breathtaking Views,"Entertainment District, Toronto (Entertainment District)",Two-Bedroom Apartment,0.7 miles from downtown,Free airport taxi,$496,,,,,,,,,
2025-10-02,booking.com,2.0,2025-10-10,2025-10-13,Gabby's Place Downtown Core,"Cabbagetown, Toronto (Cabbagetown)",Studio,0.8 miles from downtown,Free airport taxi,$191,,,,,,,,,
2025-10-02,booking.com,2.0,2025-10-10,2025-10-13,Lovely 2 Bed Condo in Downtown Toronto,"Downtown Toronto, Toronto",One-Bedroom Apartment,1.1 miles from downtown,Free airport taxi,$194,,,,,,,,,
2025-10-02,booking.com,2.0,2025-10-10,2025-10-13,Le Germain Hotel Maple Leaf Square,"Entertainment District, Toronto (Entertainment District)",Classic King Room,0.6 miles from downtown,Free airport taxi,$284,,,,,,,,,
2025-10-02,booking.com,2.0,2025-10-10,2025-10-13,Residence Inn by Marriott Toronto Downtown / Entertainment District,"Entertainment District, Toronto (Entertainment District)",King Studio with Sofa Bed,0.7 miles from downtown,,$222,,,,,,,,,
2025-10-02,booking.com,2.0,2025-10-10,2025-10-13,"Stylish Stay Toronto Oasis - Reg # STR-2309-HMVRVX exp Feb 21, 2026","The Village, Toronto (The Village)",One-Bedroom Apartment,0.5 miles from downtown,Free airport taxi,$210,,,,,,,,,
2025-10-02,booking.com,2.0,2025-10-10,2025-10-13,Downtown Luxury Victorian Retreat,"Cabbagetown, Toronto (Cabbagetown)",Deluxe Queen Room with Garden View,0.8 miles from downtown,Free airport taxi,$260,,,,,,,,,
2025-10-02,booking.com,2.0,2025-10-10,2025-10-13,"Elegant 2BR & 2BA Retreat in Prime Yorkville, Downtown","Bloor-Yorkville, Toronto (Bloor-Yorkville)",Two-Bedroom Apartment with City View,1.4 miles from downtown,Free airport taxi,$266,,,,,,,,,
2025-10-02,booking.com,2.0,2025-10-10,2025-10-13,Modern Apartment Close To The Beach with Parking,Toronto,Two-Bedroom Apartment,3.6 miles from downtown,Free airport taxi,$268,,,,,,,,,
2025-10-02,booking.com,2.0,2025-10-10,2025-10-13,Filmores Hotel,"Downtown Toronto, Toronto",Queen Room,0.6 miles from downtown,,$153,,,,,,,,,
2025-10-02,booking.com,2.0,2025-10-10,2025-10-13,Central Downtown Toronto - Trinity Bellwood Park,"Downtown Toronto, Toronto",Studio Apartment,1.4 miles from downtown,,$131,,,,,,,,,
2025-10-02,booking.com,2.0,2025-10-10,2025-10-13,Xiao Wang,"The Annex, Toronto (The Annex)",Deluxe Room,1.6 miles from downtown,,$186,,,,,,,,,
2025-10-02,booking.com,2.0,2025-10-10,2025-10-13,Toronto Airport Marriott Hotel,"Etobicoke, Toronto",King Room,10.8 miles from downtown,,$134,,,,,,,,,
2025-10-02,booking.com,2.0,2025-10-10,2025-10-13,Yorkville Condo near STK,"Bloor-Yorkville, Toronto (Bloor-Yorkville)",One-Bedroom Apartment with Garden View,1.4 miles from downtown,Free airport taxi,$177,,,,,,,,,
2025-10-02,booking.com,2.0,2025-10-10,2025-10-13,"BISHA, a Luxury Collection Hotel, Toronto","Entertainment District, Toronto (Entertainment District)",The Nina King Room with City View,0.7 miles from downtown,,$320,,,,,,,,,
2025-10-02,booking.com,2.0,2025-10-10,2025-10-13,Beautiful Modern Toronto Luxurious Scotiabank Arena,"Entertainment District, Toronto (Entertainment District)",Apartment with Lake View,0.6 miles from downtown,Free airport taxi,$523,,,,,,,,,
2025-10-02,booking.com,2.0,2025-10-10,2025-10-13,3 BR House in Toronto Downtown,Toronto,Apartment,3 miles from downtown,Free airport taxi,$305,,,,,,,,,
2025-10-02,booking.com,2.0,2025-10-10,2025-10-13,New custom-built house in Toronto,"North York, Toronto",Three-Bedroom House,6.3 miles from downtown,Free airport taxi,$309,,,,,,,,,
2025-10-02,booking.com,2.0,2025-10-10,2025-10-13,Central Downtown 1 and Den w 3 beds Sleeps 4 by UofT,"Downtown Toronto, Toronto",Two-Bedroom Deluxe Apartment,0.9 miles from downtown,Free airport taxi,$182,,,,,,,,,
2025-10-02,booking.com,2.0,2025-10-10,2025-10-13,Carlton House,"Cabbagetown, Toronto (Cabbagetown)",Queen Room,1.3 miles from downtown,,$129,,,,,,,,,
