Date,Source,Number of People,Check-in Date,Check-out Date,Hotel name,Address,Room Type,Distance from attraction,Deal Info,price,Review,name,score,Review Score,Number of Reviews,Rating,Star Rating,Distance from Attraction,Location Score
2025-09-27,booking.com,2.0,2025-10-15,2025-10-17,Holiday Inn Toronto International Airport by IHG,"Etobicoke, Toronto (Northeast Mississauga)",Standard Room with Two Queen Beds,11.2 miles from downtown,,$186,,,,,,,,,
2025-09-27,booking.com,2.0,2025-10-15,2025-10-17,"Hotel X Toronto, a Destination by Hyatt Hotel",Toronto,King Room,2 miles from downtown,,$348,,,,,,,,,
2025-09-27,booking.com,2.0,2025-10-15,2025-10-17,InterContinental Toronto Centre by IHG,"Entertainment District, Toronto (Entertainment District)",Queen Room with Two Queen Beds - Executive Level - Non-Smoking,0.5 miles from downtown,,$708,,,,,,,,,
2025-09-27,booking.com,2.0,2025-10-15,2025-10-17,Fairmont Royal York Hotel,"Financial District, Toronto (Entertainment District)",Queen Room,0.4 miles from downtown,,$458,,,,,,,,,
2025-09-27,booking.com,2.0,2025-10-15,2025-10-17,Gladstone House,"West Queen West, Toronto (West Queen West)",Studio Queen,2.3 miles from downtown,,$335,,,,,,,,,
2025-09-27,booking.com,2.0,2025-10-15,2025-10-17,The Novotel Toronto Centre,"Old Town Toronto, Toronto (Old Town Toronto)",Superior with Two Queen Beds,0.5 miles from downtown,,$544,,,,,,,,,
2025-09-27,booking.com,2.0,2025-10-15,2025-10-17,Best Western Plus Travel Hotel Toronto Airport,Toronto,Queen Room,10.9 miles from downtown,,$132,,,,,,,,,
2025-09-27,booking.com,2.0,2025-10-15,2025-10-17,Embassy Suites By Hilton Toronto Airport,"Etobicoke, Toronto (Northeast Mississauga)",Two-Room King Suite,11 miles from downtown,,$153,,,,,,,,,
2025-09-27,booking.com,2.0,2025-10-15,2025-10-17,Comfort Iceboat Suites Lakeview & Free Parking,"Downtown Toronto, Toronto",Two-Bedroom Apartment,1.1 miles from downtown,,$178,,,,,,,,,
2025-09-27,booking.com,2.0,2025-10-15,2025-10-17,SoHo Hotel Toronto,"Entertainment District, Toronto (Entertainment District)",Luxury King Room,0.7 miles from downtown,,$354,,,,,,,,,
2025-09-27,booking.com,2.0,2025-10-15,2025-10-17,Hilton Toronto,"Financial District, Toronto (Financial District)",Deluxe Queen Room with Two Queen Beds,0.2 miles from downtown,,$360,,,,,,,,,
2025-09-27,booking.com,2.0,2025-10-15,2025-10-17,Crowne Plaza Toronto Airport by IHG,"Etobicoke, Toronto",Standard Room,10.5 miles from downtown,,$167,,,,,,,,,
2025-09-27,booking.com,2.0,2025-10-15,2025-10-17,Holiday Inn Express Toronto Downtown by IHG,"Old Town Toronto, Toronto (Old Town Toronto)",Standard King Room,0.5 miles from downtown,,$408,,,,,,,,,
2025-09-27,booking.com,2.0,2025-10-15,2025-10-17,Regis Suites - Downtown Toronto - CN Tower & Rogers Centre,"Downtown Toronto, Toronto",Two-Bedroom Apartment,0.9 miles from downtown,,$322,,,,,,,,,
2025-09-27,booking.com,2.0,2025-10-15,2025-10-17,Novotel Toronto North York,"North York, Toronto",Executive King Room,8.2 miles from downtown,,$229,,,,,,,,,
2025-09-27,booking.com,2.0,2025-10-15,2025-10-17,B Hotel,Toronto,Suite with City View,2.7 miles from downtown,,$143,,,,,,,,,
2025-09-27,booking.com,2.0,2025-10-15,2025-10-17,Canopy By Hilton Toronto Yorkville,"Downtown Toronto, Toronto",Queen Room with Two Queen Beds,1.4 miles from downtown,,$359,,,,,,,,,
2025-09-27,booking.com,2.0,2025-10-15,2025-10-17,Toronto Midtown Home Suites,Toronto,Queen Room,3.6 miles from downtown,,$89,,,,,,,,,
2025-09-27,booking.com,2.0,2025-10-15,2025-10-17,Spark by Hilton Toronto Airport,"Etobicoke, Toronto",King Room,10.8 miles from downtown,,$105,,,,,,,,,
2025-09-27,booking.com,2.0,2025-10-15,2025-10-17,"Doubletree by Hilton Toronto Airport, ON","Etobicoke, Toronto (Northeast Mississauga)",King Room,11 miles from downtown,,$173,,,,,,,,,
2025-09-27,booking.com,2.0,2025-10-15,2025-10-17,Holiday Inn Toronto Airport East by IHG,"Etobicoke, Toronto",Standard Queen Room with Two Queen Beds,9.9 miles from downtown,,$164,,,,,,,,,
2025-09-27,booking.com,2.0,2025-10-15,2025-10-17,Downtown west Suites,"Entertainment District, Toronto (Entertainment District)",Two-Bedroom Apartment,0.7 miles from downtown,,$268,,,,,,,,,
2025-09-27,booking.com,2.0,2025-10-15,2025-10-17,The Parkdale Hostellerie,Toronto,One-Bedroom Apartment,2.6 miles from downtown,,$85,,,,,,,,,
2025-09-27,booking.com,2.0,2025-10-15,2025-10-17,Woodbine Hotel & Suites,"Etobicoke, Toronto",Queen Room,11.3 miles from downtown,,$100,,,,,,,,,
2025-09-27,booking.com,2.0,2025-10-15,2025-10-17,Sweet Home,"Downtown Toronto, Toronto",Quadruple Room with Private Bathroom,0.6 miles from downtown,,$157,,,,,,,,,
2025-09-27,booking.com,2.0,2025-10-15,2025-10-17,Adas Guesthouse,"Downtown Toronto, Toronto",Standard Queen Room,1.3 miles from downtown,,$90,,,,,,,,,
2025-09-27,booking.com,2.0,2025-10-15,2025-10-17,Holiday Inn Express & Suites Toronto Airport South by IHG,"Etobicoke, Toronto (Northeast Mississauga)",Standard Room with Two Queen Beds,10.5 miles from downtown,,$197,,,,,,,,,
2025-09-27,booking.com,2.0,2025-10-15,2025-10-17,Ace Hotel Toronto,"Fashion District, Toronto (Fashion District)",King Room,0.9 miles from downtown,,$348,,,,,,,,,
2025-09-27,booking.com,2.0,2025-10-15,2025-10-17,Breezy Lake And City Views - One Free Underground Parking,"Downtown Toronto, Toronto",Two-Bedroom Apartment,1.1 miles from downtown,,$243,,,,,,,,,
2025-09-27,booking.com,2.0,2025-10-15,2025-10-17,Hampton Inn & Suites by Hilton Toronto Downtown,"The Village, Toronto (The Village)",King Room,0.7 miles from downtown,,$233,,,,,,,,,
2025-09-27,booking.com,2.0,2025-10-15,2025-10-17,Courtyard by Marriott Toronto Airport,"Etobicoke, Toronto (Northeast Mississauga)",Queen Room with Two Queen Beds,10.9 miles from downtown,,$204,,,,,,,,,
2025-09-27,booking.com,2.0,2025-10-15,2025-10-17,Yorkville Plaza Suites - Pool & Hot Tub,"Bloor-Yorkville, Toronto (Bloor-Yorkville)",Two-Bedroom Apartment,1.4 miles from downtown,,$430,,,,,,,,,
2025-09-27,booking.com,2.0,2025-10-15,2025-10-17,Sonder by Marriott Bonvoy The Liberty Apartments Liberty Village,Toronto,One-Bedroom Superior Apartment with Queen Bed,2.2 miles from downtown,,$338,,,,,,,,,
2025-09-27,booking.com,2.0,2025-10-15,2025-10-17,Union Hotel,"Financial District, Toronto (Financial District)",King Room,0.4 miles from downtown,,$403,,,,,,,,,
2025-09-27,booking.com,2.0,2025-10-15,2025-10-17,W Toronto,"Bloor-Yorkville, Toronto (Bloor-Yorkville)",Standard King Room with Courtyard View,1.3 miles from downtown,,$424,,,,,,,,,
2025-09-27,booking.com,2.0,2025-10-15,2025-10-17,Toronto Marriott City Centre Hotel,"Entertainment District, Toronto (Entertainment District)","Guest room, 1 Queen",0.8 miles from downtown,,$580,,,,,,,,,
2025-09-27,booking.com,2.0,2025-10-15,2025-10-17,Hyatt Regency Toronto,"Entertainment District, Toronto (Entertainment District)",Queen Room with Two Queen Beds,0.6 miles from downtown,,$373,,,,,,,,,
2025-09-27,booking.com,2.0,2025-10-15,2025-10-17,Queen Nest Hotel,"Downtown Toronto, Toronto",Standard Queen Room,1.3 miles from downtown,,$105,,,,,,,,,
2025-09-27,booking.com,2.0,2025-10-15,2025-10-17,Toronto Don Valley Hotel and Suites,"North York, Toronto",Double Room,5.7 miles from downtown,,$107,,,,,,,,,
2025-09-27,booking.com,2.0,2025-10-15,2025-10-17,"Revery Toronto Downtown, Curio Collection by Hilton","Entertainment District, Toronto (Entertainment District)",Queen Room with Two Queen Beds,0.6 miles from downtown,,$336,,,,,,,,,
2025-09-27,booking.com,2.0,2025-10-15,2025-10-17,Core Downtown Toronto-3 Bedrooms-2 Bathrooms-Washrooms-Free Parking-CN Tower-Ripleys Museum-Blue Jays Stadium In front-Indoor Gym-Swimming Pool-Jacuzzi Sauna-Filter Drinking Water-WiFi,"Entertainment District, Toronto (Entertainment District)",Three-Bedroom Apartment,0.7 miles from downtown,,$294,,,,,,,,,
2025-09-27,booking.com,2.0,2025-10-15,2025-10-17,Old Mill Toronto Hotel,"Etobicoke, Toronto",Basic Queen Room,5.5 miles from downtown,,$193,,,,,,,,,
2025-09-27,booking.com,2.0,2025-10-15,2025-10-17,Sheraton Toronto Airport Hotel & Conference Centre,"Etobicoke, Toronto","Traditional, Guest room, 2 Queen",10.5 miles from downtown,,$245,,,,,,,,,
2025-09-27,booking.com,2.0,2025-10-15,2025-10-17,A Home Away-Deluxe Guest Room in Toronto,"North York, Toronto",Queen Room,9.5 miles from downtown,,$59,,,,,,,,,
2025-09-27,booking.com,2.0,2025-10-15,2025-10-17,EST Hotel,"Etobicoke, Toronto",Standard one Queen bed,13 miles from downtown,,$129,,,,,,,,,
2025-09-27,booking.com,2.0,2025-10-15,2025-10-17,Warm Downtown Home,"Old Town Toronto, Toronto (Old Town Toronto)",Double Room,0.5 miles from downtown,Late Escape Deal,$103,,,,,,,,,
2025-09-27,booking.com,2.0,2025-10-15,2025-10-17,Kimpton Saint George Hotel by IHG,"The Annex, Toronto (The Annex)",Premium Queen Room with Two Queen Beds and Walk-In Shower,1.4 miles from downtown,,$496,,,,,,,,,
2025-09-27,booking.com,2.0,2025-10-15,2025-10-17,"The Anndore House, part of JDV by Hyatt","The Village, Toronto (The Village)",Queen Loft,1.2 miles from downtown,,$479,,,,,,,,,
2025-09-27,booking.com,2.0,2025-10-15,2025-10-17,Stay Inn Hotel Toronto,"Etobicoke, Toronto",Business King Room - Fully Renovated 2021,8.6 miles from downtown,,$148,,,,,,,,,
2025-09-27,booking.com,2.0,2025-10-15,2025-10-17,Luxury view in Toronto Downtown 3 Bedroom 2.5 Bathroom 1 Parking,"Downtown Toronto, Toronto",Three-Bedroom Apartment,0.9 miles from downtown,,$488,,,,,,,,,
2025-09-27,booking.com,2.0,2025-10-15,2025-10-17,Comfort Inn & Conference Centre Toronto Airport,"Etobicoke, Toronto",Standard King Room,10.7 miles from downtown,,$105,,,,,,,,,
2025-09-27,booking.com,2.0,2025-10-15,2025-10-17,Falstaff Home,Toronto,Junior Suite,7.3 miles from downtown,Late Escape Deal,$63,,,,,,,,,
2025-09-27,booking.com,2.0,2025-10-15,2025-10-17,Super 8 by Wyndham Toronto East ON,"Scarborough, Toronto",Queen Room - Smoking,9.7 miles from downtown,,$107,,,,,,,,,
2025-09-27,booking.com,2.0,2025-10-15,2025-10-17,Four Seasons Hotel Toronto,"Bloor-Yorkville, Toronto (Bloor-Yorkville)",Deluxe One-Bedroom Suite,1.4 miles from downtown,,"$1,415",,,,,,,,,
2025-09-27,booking.com,2.0,2025-10-15,2025-10-17,1 Hotel Toronto,"Fashion District, Toronto (Fashion District)",King Room with Balcony,1.2 miles from downtown,,$812,,,,,,,,,
2025-09-27,booking.com,2.0,2025-10-15,2025-10-17,Luxury Spacious 3 Bedrooms Trinity Bellwoods,Toronto,Apartment,2.2 miles from downtown,,$278,,,,,,,,,
2025-09-27,booking.com,2.0,2025-10-15,2025-10-17,Dragon Gate Inn,"Downtown Toronto, Toronto",Superior Studio (2 Adults),1.3 miles from downtown,,$123,,,,,,,,,
2025-09-27,booking.com,2.0,2025-10-15,2025-10-17,Courtyard by Marriott Toronto Downtown,"The Village, Toronto (The Village)",King Room with City View,0.8 miles from downtown,,$245,,,,,,,,,
2025-09-27,booking.com,2.0,2025-10-15,2025-10-17,freed Suites - Downtown Toronto,"Entertainment District, Toronto (Entertainment District)",Two-Bedroom Apartment with Balcony,0.4 miles from downtown,,$322,,,,,,,,,
2025-09-27,booking.com,2.0,2025-10-15,2025-10-17,Royal Oak Inn,"Cabbagetown, Toronto (Cabbagetown)",Double Room,0.8 miles from downtown,,$120,,,,,,,,,
2025-09-27,booking.com,2.0,2025-10-15,2025-10-17,Lakeview Condo in Downtown with Free Parking.,"Downtown Toronto, Toronto",Two-Bedroom Apartment,1.5 miles from downtown,,$297,,,,,,,,,
2025-09-27,booking.com,2.0,2025-10-15,2025-10-17,The Westin Toronto Airport,"Etobicoke, Toronto (Northeast Mississauga)","Traditional, Guest room, 1 King",11.1 miles from downtown,,$174,,,,,,,,,
2025-09-27,booking.com,2.0,2025-10-15,2025-10-17,Hotel Victoria,"Financial District, Toronto (Financial District)",Standard Queen Room,0.3 miles from downtown,,$222,,,,,,,,,
2025-09-27,booking.com,2.0,2025-10-15,2025-10-17,Pantages Hotel Toronto Centre,"Yonge - Dundas, Toronto (Yonge - Dundas)",Deluxe King Room,0.2 miles from downtown,,$204,,,,,,,,,
2025-09-27,booking.com,2.0,2025-10-15,2025-10-17,"The Ellios Suites - In Downtown Toronto, Opposite CN Tower & Rogers Centre","Entertainment District, Toronto (Entertainment District)",One-Bedroom Apartment,0.7 miles from downtown,,$250,,,,,,,,,
2025-09-27,booking.com,2.0,2025-10-15,2025-10-17,Stylish Condo Downtown Near CN Tower - Free parking,"Downtown Toronto, Toronto",One-Bedroom Apartment,1.1 miles from downtown,,$275,,,,,,,,,
2025-09-27,booking.com,2.0,2025-10-15,2025-10-17,Modern Toronto Lake View & CN Tower View - One Free Parking,"The Harbourfront, Toronto (Entertainment District)",Two-Bedroom Apartment,0.6 miles from downtown,Late Escape Deal,$266,,,,,,,,,
2025-09-27,booking.com,2.0,2025-10-15,2025-10-17,Sonder by Marriott Bonvoy Artesa Apartments West Queen West,Toronto,One-Bedroom Apartment with Double Bed and Balcony,2.4 miles from downtown,,$271,,,,,,,,,
2025-09-27,booking.com,2.0,2025-10-15,2025-10-17,Two BD CN Tower and Lake Ontario View,"Entertainment District, Toronto (Entertainment District)",Two-Bedroom Apartment,0.7 miles from downtown,,$323,,,,,,,,,
2025-09-27,booking.com,2.0,2025-10-15,2025-10-17,Deluxe Inn,"Etobicoke, Toronto",Queen Room - Non-Smoking,8.2 miles from downtown,,$89,,,,,,,,,
2025-09-27,booking.com,2.0,2025-10-15,2025-10-17,Spectacular condo downtown with a view,"Downtown Toronto, Toronto",Deluxe Double Room with Balcony,1.1 miles from downtown,,$141,,,,,,,,,
2025-09-27,booking.com,2.0,2025-10-15,2025-10-17,Madison Manor Boutique Hotel,"The Annex, Toronto (The Annex)",Partner offer option,1.5 miles from downtown,,$176,,,,,,,,,
2025-09-27,booking.com,2.0,2025-10-15,2025-10-17,Belarte Suites - Downtown Toronto - CN Tower & Rogers Centre,"Entertainment District, Toronto (Entertainment District)",Three-Bedroom Apartment,0.7 miles from downtown,,$716,,,,,,,,,
2025-09-27,booking.com,2.0,2025-10-15,2025-10-17,Residence Inn by Marriott Toronto Airport,"Etobicoke, Toronto",King or Queen Suite with Sofa Bed,10.6 miles from downtown,,$140,,,,,,,,,
2025-09-27,booking.com,2.0,2025-10-15,2025-10-17,The Westlake,"Etobicoke, Toronto",Queen Suite,7 miles from downtown,,$189,,,,,,,,,
2025-09-27,booking.com,2.0,2025-10-15,2025-10-17,9mins airport 1 min to shopping mall,"Etobicoke, Toronto",Small Double Room,9.6 miles from downtown,,$45,,,,,,,,,
2025-09-27,booking.com,2.0,2025-10-15,2025-10-17,Hotel Ocho,"Downtown Toronto, Toronto",Standard Queen Room,0.7 miles from downtown,,$211,,,,,,,,,
2025-09-27,booking.com,2.0,2025-10-15,2025-10-17,"Large Downtown 2Br condo with Parking steps to Eaton Centre, UofT and SickKids","Downtown Toronto, Toronto",Two-Bedroom Apartment,0.6 miles from downtown,,$242,,,,,,,,,
2025-09-27,booking.com,2.0,2025-10-15,2025-10-17,RivetStays - The Jarvis,"Downtown Toronto, Toronto",Deluxe Queen Suite,0.5 miles from downtown,,$184,,,,,,,,,
2025-09-27,booking.com,2.0,2025-10-15,2025-10-17,Luxury Basement-Private Bdr & Bathroom with free parking In Toronto,"Etobicoke, Toronto",Superior Queen Room,12.5 miles from downtown,,$57,,,,,,,,,
2025-09-27,booking.com,2.0,2025-10-15,2025-10-17,Stylish Condos Toronto,"Entertainment District, Toronto (Entertainment District)",Two-Bedroom Apartment,0.7 miles from downtown,,$270,,,,,,,,,
2025-09-27,booking.com,2.0,2025-10-15,2025-10-17,Best Western Plus Toronto North York Hotel & Suites,"North York, Toronto",Queen Room,10.3 miles from downtown,,$115,,,,,,,,,
2025-09-27,booking.com,2.0,2025-10-15,2025-10-17,The Hazelton Hotel,"Bloor-Yorkville, Toronto (Bloor-Yorkville)","Deluxe Room, 1 King Bed, Balcony",1.4 miles from downtown,,$871,,,,,,,,,
2025-09-27,booking.com,2.0,2025-10-15,2025-10-17,Yonge Suites Apart Hotel,"Yonge - Dundas, Toronto (Yonge Street)",One-Bedroom Apartment,0.2 miles from downtown,,$247,,,,,,,,,
2025-09-27,booking.com,2.0,2025-10-15,2025-10-17,"Toor Hotel Toronto, Part Of Jdv By Hyatt","Downtown Toronto, Toronto",King Room,0.5 miles from downtown,,$332,,,,,,,,,
2025-09-27,booking.com,2.0,2025-10-15,2025-10-17,Luxury condo on CN TOWER,"Entertainment District, Toronto (Entertainment District)",Apartment,0.7 miles from downtown,,$344,,,,,,,,,
2025-09-27,booking.com,2.0,2025-10-15,2025-10-17,TononHouse,"North York, Toronto",Queen Room,9.2 miles from downtown,Late Escape Deal,$57,,,,,,,,,
2025-09-27,booking.com,2.0,2025-10-15,2025-10-17,Nobu Suites - Toronto's Entertainment District,"Entertainment District, Toronto (Entertainment District)",Two-Bedroom Apartment,0.4 miles from downtown,,$430,,,,,,,,,
2025-09-27,booking.com,2.0,2025-10-15,2025-10-17,Modern 1Bd & Den Condo with Balcony Lillian St,Toronto,One-Bedroom Apartment with Balcony,3.9 miles from downtown,Late Escape Deal,$186,,,,,,,,,
2025-09-27,booking.com,2.0,2025-10-15,2025-10-17,The Alexandra Hotel,"Downtown Toronto, Toronto",Double and Single Bed Room,1 miles from downtown,,$128,,,,,,,,,
2025-09-27,booking.com,2.0,2025-10-15,2025-10-17,"Room in cozy house close to Lawrence Ave, WiFi, parking","North York, Toronto",Deluxe Double or Twin Room,5.5 miles from downtown,,$71,,,,,,,,,
2025-09-27,booking.com,2.0,2025-10-15,2025-10-17,Best Western Premier Toronto Airport Carlingview Hotel,"Etobicoke, Toronto (Northeast Mississauga)",King Room - Non-Smoking/Shower Only,10.7 miles from downtown,,$129,,,,,,,,,
2025-09-27,booking.com,2.0,2025-10-15,2025-10-17,Modern Apartment Close To The Beach with Parking,Toronto,Two-Bedroom Apartment,3.6 miles from downtown,,$258,,,,,,,,,
2025-09-27,booking.com,2.0,2025-10-15,2025-10-17,2BR Yorkville Condo - Self Check In & Free Parking,"Bloor-Yorkville, Toronto (Bloor-Yorkville)",Two-Bedroom Apartment,1.3 miles from downtown,,$193,,,,,,,,,
2025-09-27,booking.com,2.0,2025-10-15,2025-10-17,Marriott Downtown at CF Toronto Eaton Centre,"Yonge - Dundas, Toronto (Yonge - Dundas)","Guest room, 2 Double",0.2 miles from downtown,,$351,,,,,,,,,
2025-09-27,booking.com,2.0,2025-10-15,2025-10-17,Upgraded Rooms with Bath 7-min to Subway Near Downsview Rogers Stadium,"North York, Toronto",Economy Double Room,7.7 miles from downtown,,$85,,,,,,,,,
2025-09-27,booking.com,2.0,2025-10-15,2025-10-17,Spectacular 3 BR 2 WR House - Close to Airport,"Etobicoke, Toronto",Three-Bedroom Apartment,9.4 miles from downtown,,$181,,,,,,,,,
2025-09-27,booking.com,2.0,2025-10-15,2025-10-17,Holiday Inn Express Toronto-North York by IHG,"North York, Toronto",Standard King Room,10.2 miles from downtown,,$127,,,,,,,,,
2025-09-27,booking.com,2.0,2025-10-15,2025-10-17,"DOWNTOWN, LUXURY CONDO, CN TOWER, ROGERS CENTER, SCOCIA ARENA, UNOBSTRUCTED VIEW","Entertainment District, Toronto (Entertainment District)",One-Bedroom Apartment,0.7 miles from downtown,,$522,,,,,,,,,
2025-09-27,booking.com,2.0,2025-10-15,2025-10-17,Hazelton Suites - Yorkville - Indoor Pool & Hot Tub,"Bloor-Yorkville, Toronto (Bloor-Yorkville)",Apartment with View and Balcony,1.4 miles from downtown,,$716,,,,,,,,,
2025-09-27,booking.com,2.0,2025-10-15,2025-10-17,Modern Lux Family Rooms - KingBed - Near Sheppard W Station Toronto,"North York, Toronto",Family Room,8.4 miles from downtown,,$100,,,,,,,,,
2025-09-27,booking.com,2.0,2025-10-15,2025-10-17,La TUMU,"The Village, Toronto (The Village)",Deluxe King Studio,0.9 miles from downtown,,$205,,,,,,,,,
2025-09-27,booking.com,2.0,2025-10-15,2025-10-17,Montecassino Hotel & Event Centre,"North York, Toronto",Run Of The House,8.6 miles from downtown,,$145,,,,,,,,,
2025-09-27,booking.com,2.0,2025-10-15,2025-10-17,"Chic 3BR apartment in Queen West, Downtown Toronto",Toronto,Three-Bedroom Apartment,3.1 miles from downtown,,$120,,,,,,,,,
2025-09-27,booking.com,2.0,2025-10-15,2025-10-17,Bright & New 2 Beds Near Subway,"The Danforth, Toronto (The Danforth)",Two-Bedroom Apartment,2.7 miles from downtown,,$116,,,,,,,,,
2025-09-27,booking.com,2.0,2025-10-15,2025-10-17,Toronto Airport Marriott Hotel,"Etobicoke, Toronto",Double Guest Room,10.8 miles from downtown,,$229,,,,,,,,,
2025-09-27,booking.com,2.0,2025-10-15,2025-10-17,Downtown Luxury Victorian Retreat,"Cabbagetown, Toronto (Cabbagetown)",Modern Luxury Room,0.8 miles from downtown,,$231,,,,,,,,,
2025-09-27,booking.com,2.0,2025-10-15,2025-10-17,Gabby's Place Downtown Core,"Cabbagetown, Toronto (Cabbagetown)",One-Bedroom Suite,0.8 miles from downtown,,$179,,,,,,,,,
2025-09-27,booking.com,2.0,2025-10-15,2025-10-17,Beautiful Luxurious Modern Condo With Breathtaking Views,"Entertainment District, Toronto (Entertainment District)",Two-Bedroom Apartment,0.7 miles from downtown,,$409,,,,,,,,,
2025-09-27,booking.com,2.0,2025-10-15,2025-10-17,Downtown Toronto Condo CN Tower,"The Harbourfront, Toronto (Entertainment District)",One-Bedroom Apartment,0.7 miles from downtown,Late Escape Deal,$322,,,,,,,,,
2025-09-27,booking.com,2.0,2025-10-15,2025-10-17,Downtown Toronto 3 Bedrooms - 1 Free Parking,"Downtown Toronto, Toronto",Three-Bedroom Apartment,1.4 miles from downtown,,$214,,,,,,,,,
2025-09-27,booking.com,2.0,2025-10-15,2025-10-17,Xiao Wang,"The Annex, Toronto (The Annex)",Queen Room with Garden View,1.6 miles from downtown,,$250,,,,,,,,,
2025-09-27,booking.com,2.0,2025-10-15,2025-10-17,Cozy & Modern Ensuite Basement Rooms - Steps to Subway & Downsview Rogers Stadium,"North York, Toronto",Double Room with Private Bathroom,6.8 miles from downtown,,$77,,,,,,,,,
2025-09-27,booking.com,2.0,2025-10-15,2025-10-17,Downtown Toronto 2 bedrooms with parking,"Entertainment District, Toronto (Entertainment District)",Two-Bedroom Apartment with Balcony,0.7 miles from downtown,Late Escape Deal,$265,,,,,,,,,
2025-09-27,booking.com,2.0,2025-10-15,2025-10-17,Burano Condo 1 BD in Downtown Toronto,"Downtown Toronto, Toronto",One-Bedroom Apartment,0.7 miles from downtown,Late Escape Deal,$217,,,,,,,,,
2025-09-27,booking.com,2.0,2025-10-15,2025-10-17,Central Downtown Toronto - Trinity Bellwood Park,"Downtown Toronto, Toronto",Studio Apartment,1.4 miles from downtown,,$136,,,,,,,,,
2025-09-27,booking.com,2.0,2025-10-15,2025-10-17,Lovely 2 Bed Condo in Downtown Toronto,"Downtown Toronto, Toronto",One-Bedroom Apartment,1.1 miles from downtown,,$194,,,,,,,,,
2025-09-27,booking.com,2.0,2025-10-15,2025-10-17,Filmores Hotel,"Downtown Toronto, Toronto",Queen Room,0.6 miles from downtown,,$143,,,,,,,,,
2025-09-27,booking.com,2.0,2025-10-15,2025-10-17,Beautiful Modern Toronto Luxurious Scotiabank Arena,"Entertainment District, Toronto (Entertainment District)",Apartment with Lake View,0.6 miles from downtown,,$428,,,,,,,,,
2025-09-27,booking.com,2.0,2025-10-15,2025-10-17,Stunning Rooms in Townhouse across the Beach,"The Beaches, Toronto (The Beaches)",Deluxe Double Room with Bath,4 miles from downtown,,$115,,,,,,,,,
2025-09-27,booking.com,2.0,2025-10-15,2025-10-17,Downtown Escape Stylish Condo with City Views,"The Harbourfront, Toronto (The Harbourfront)",Apartment,1.3 miles from downtown,,$137,,,,,,,,,
2025-09-27,booking.com,2.0,2025-10-15,2025-10-17,Central Downtown 1 and Den w 3 beds Sleeps 4 by UofT,"Downtown Toronto, Toronto",Two-Bedroom Deluxe Apartment,0.9 miles from downtown,,$220,,,,,,,,,
2025-09-27,booking.com,2.0,2025-10-15,2025-10-17,Modern 1BD Apartment with Balcony DT Toronto,"Downtown Toronto, Toronto",One-Bedroom Apartment with Balcony,0.9 miles from downtown,Late Escape Deal,$217,,,,,,,,,
2025-09-27,booking.com,2.0,2025-10-15,2025-10-17,Classy and Luxury 2 bedroom apartment 5 mins to Dundas Square,"The Village, Toronto (The Village)",Two-Bedroom Apartment,0.5 miles from downtown,Late Escape Deal,$251,,,,,,,,,
2025-09-27,booking.com,2.0,2025-10-15,2025-10-17,Superior 1Bedroom&DEN Condo with Balcony,"Downtown Toronto, Toronto",One-Bedroom Apartment with Lake View,1.6 miles from downtown,Late Escape Deal,$184,,,,,,,,,
2025-09-27,booking.com,2.0,2025-10-15,2025-10-17,"BISHA, a Luxury Collection Hotel, Toronto","Entertainment District, Toronto (Entertainment District)",The Grace Queen Room with Two Queen Beds and City View,0.7 miles from downtown,,$515,,,,,,,,,
2025-09-27,booking.com,2.0,2025-10-15,2025-10-17,A Seaton Dream,"Cabbagetown, Toronto (Cabbagetown)",Queen Room,0.8 miles from downtown,,$200,,,,,,,,,
2025-09-27,booking.com,2.0,2025-10-15,2025-10-17,"Skyline Royale Penthouse - Downtown Toronto - CN Tower View, Balcony, Pool, Hot Tub","Entertainment District, Toronto (Entertainment District)",Three-Bedroom Premium Apartment,0.7 miles from downtown,,$645,,,,,,,,,
2025-09-27,booking.com,2.0,2025-10-15,2025-10-17,Unbeatable Lake View 1bd & den in Downtown Toronto,"Downtown Toronto, Toronto",One-Bedroom Apartment,1.1 miles from downtown,Late Escape Deal,$171,,,,,,,,,
2025-09-27,booking.com,2.0,2025-10-15,2025-10-17,New custom-built house in Toronto,"North York, Toronto",Three-Bedroom House,6.3 miles from downtown,,$261,,,,,,,,,
2025-09-27,booking.com,2.0,2025-10-15,2025-10-17,The Roland Inviting 2BR Basement Suite in Downtown Toronto,"Old Town Toronto, Toronto (Old Town Toronto)",Suite,1.3 miles from downtown,,$173,,,,,,,,,
2025-09-27,booking.com,2.0,2025-10-15,2025-10-17,The Charming Downtown Stop,"The Village, Toronto (The Village)",One-Bedroom Apartment,0.9 miles from downtown,,$197,,,,,,,,,
2025-09-27,booking.com,2.0,2025-10-15,2025-10-17,3 BR Panoramas Lake Ontario and CN Tower View,"Downtown Toronto, Toronto",Three-Bedroom Apartment with Balcony,0.7 miles from downtown,Late Escape Deal,$286,,,,,,,,,
2025-09-27,booking.com,2.0,2025-10-15,2025-10-17,The Broadview Hotel,Toronto,King Room,1.7 miles from downtown,,$505,,,,,,,,,
2025-09-27,booking.com,2.0,2025-10-15,2025-10-17,Full Privacy house with Free parkings,Toronto,Apartment,5.3 miles from downtown,,$225,,,,,,,,,
2025-09-27,booking.com,2.0,2025-10-15,2025-10-17,Downtown Toronto Studio Retreat,"Yonge - Dundas, Toronto (Yonge - Dundas)",Apartment,0.2 miles from downtown,,$136,,,,,,,,,
2025-09-27,booking.com,2.0,2025-10-15,2025-10-17,Nobu Hotel Toronto,"Entertainment District, Toronto (Entertainment District)",Deluxe King Room,0.6 miles from downtown,,$990,,,,,,,,,
2025-09-27,booking.com,2.0,2025-10-15,2025-10-17,The Downtown Gem Toronto,"Downtown Toronto, Toronto (Queen West)",Deluxe Queen Room,0.8 miles from downtown,,$77,,,,,,,,,
2025-09-27,booking.com,2.0,2025-10-15,2025-10-17,Relax in East York Space Share,Toronto,Bungalow,3.5 miles from downtown,,$52,,,,,,,,,
