Date,Source,Number of People,Check-in Date,Check-out Date,Hotel name,Address,Room Type,Distance from attraction,Deal Info,price,Review,name,score,Review Score,Number of Reviews,Rating,Star Rating,Distance from Attraction,Location Score
2025-10-03,booking.com,2.0,2025-10-13,2025-10-15,Modern 1BD Apartment with Balcony DT Toronto,"Downtown Toronto, Toronto",One-Bedroom Apartment with Balcony,0.9 miles from downtown,Late Escape Deal,$190,,,,,,,,,
2025-10-03,booking.com,2.0,2025-10-13,2025-10-15,Tom home,Toronto,Double Room with Shared Toilet,5 miles from downtown,,$59,,,,,,,,,
2025-10-03,booking.com,2.0,2025-10-13,2025-10-15,3 BR Panoramas Lake Ontario and CN Tower View,"Downtown Toronto, Toronto",Three-Bedroom Apartment with Balcony,0.7 miles from downtown,Late Escape Deal,$219,,,,,,,,,
2025-09-19,booking.com,,2025-10-03,2025-10-06,,,,,,$261,,Riu Plaza Toronto,,,,,,,
2025-10-08,booking.com,2.0,2025-10-10,2025-10-13,Chelsea Hotel Toronto,"Yonge - Dundas, Toronto (Yonge - Dundas)",Standard Double Room with Two Double Beds,0.5 miles from downtown,,$216,,,,,,,,,
2025-10-08,booking.com,2.0,2025-10-10,2025-10-13,Sonder by Marriott Bonvoy The Liberty Apartments Liberty Village,Toronto,One-Bedroom Apartment with Queen Bed and Balcony,2.2 miles from downtown,,$189,,,,,,,,,
2025-10-08,booking.com,2.0,2025-10-10,2025-10-13,Samesun Toronto,"Kensington Market, Toronto (Kensington Market)",Queen Room with Balcony,1.1 miles from downtown,,$170,,,,,,,,,
2025-10-08,booking.com,2.0,2025-10-10,2025-10-13,Homewood Suites by Hilton Toronto Airport Corporate Centre,Toronto,One-Bedroom King Suite - Non-Smoking,11 miles from downtown,,$152,,,,,,,,,
2025-10-08,booking.com,2.0,2025-10-10,2025-10-13,Town Inn Suites Hotel,"The Village, Toronto (The Village)",Deluxe King Suite,1.2 miles from downtown,Late Escape Deal,$192,,,,,,,,,
2025-10-08,booking.com,2.0,2025-10-10,2025-10-13,The Omni King Edward Hotel,"Old Town Toronto, Toronto (Old Town Toronto)",Deluxe Room - 1 Queen Bed,0.3 miles from downtown,,$250,,,,,,,,,
2025-10-08,booking.com,2.0,2025-10-10,2025-10-13,Radisson Blu Toronto Downtown,"The Harbourfront, Toronto (The Harbourfront)",King Room with City View - Non Smoking,0.9 miles from downtown,,$233,,,,,,,,,
2025-10-08,booking.com,2.0,2025-10-10,2025-10-13,Canadas Best Value Inn Toronto,"Etobicoke, Toronto",Business Queen Room - Non Smoking,9 miles from downtown,,$104,,,,,,,,,
2025-10-08,booking.com,2.0,2025-10-10,2025-10-13,DoubleTree by Hilton Toronto Downtown,"Downtown Toronto, Toronto",King Room,0.3 miles from downtown,,$244,,,,,,,,,
2025-10-08,booking.com,2.0,2025-10-10,2025-10-13,Sheraton Centre Toronto Hotel,"Downtown Toronto, Toronto (Queen West)","Guest Room, 1 King",0.1 miles from downtown,,$231,,,,,,,,,
2025-10-08,booking.com,2.0,2025-10-10,2025-10-13,Great Canadian Casino Resort Toronto,"Etobicoke, Toronto",Premium King,11.9 miles from downtown,,$168,,,,,,,,,
2025-10-08,booking.com,2.0,2025-10-10,2025-10-13,Sandman Signature Toronto Airport Hotel,"Etobicoke, Toronto","Standard Room, 2 Queen Beds",10.7 miles from downtown,,$97,,,,,,,,,
2025-10-08,booking.com,2.0,2025-10-10,2025-10-13,Executive Hotel Cosmopolitan Toronto,"Old Town Toronto, Toronto (Old Town Toronto)",1 Bedroom,0.3 miles from downtown,,$207,,,,,,,,,
2025-10-08,booking.com,2.0,2025-10-10,2025-10-13,Holiday Inn Toronto International Airport by IHG,"Etobicoke, Toronto (Northeast Mississauga)",Standard Room,11.2 miles from downtown,,$124,,,,,,,,,
2025-10-08,booking.com,2.0,2025-10-10,2025-10-13,Fairmont Royal York Hotel,"Financial District, Toronto (Entertainment District)",Queen Room,0.4 miles from downtown,,$288,,,,,,,,,
2025-10-08,booking.com,2.0,2025-10-10,2025-10-13,The Novotel Toronto Centre,"Old Town Toronto, Toronto (Old Town Toronto)",Premier Executive Room with King Bed.,0.5 miles from downtown,,$286,,,,,,,,,
2025-10-08,booking.com,2.0,2025-10-10,2025-10-13,"Hotel X Toronto, a Destination by Hyatt Hotel",Toronto,King Room with Lake View,2 miles from downtown,,$276,,,,,,,,,
2025-10-08,booking.com,2.0,2025-10-10,2025-10-13,Embassy Suites By Hilton Toronto Airport,"Etobicoke, Toronto (Northeast Mississauga)",Two-Room King Suite,11 miles from downtown,,$245,,,,,,,,,
2025-10-08,booking.com,2.0,2025-10-10,2025-10-13,"Newly updated 2BR, 2Bath & Den in Downtown Toronto beside Union Station & Scotia Bank Arena!","Entertainment District, Toronto (Entertainment District)",Three-Bedroom Premium Apartment with Balcony,0.7 miles from downtown,,$347,,,,,,,,,
2025-10-08,booking.com,2.0,2025-10-10,2025-10-13,InterContinental Toronto Centre by IHG,"Entertainment District, Toronto (Entertainment District)",Classic King Room,0.5 miles from downtown,,$322,,,,,,,,,
2025-10-08,booking.com,2.0,2025-10-10,2025-10-13,SoHo Hotel Toronto,"Entertainment District, Toronto (Entertainment District)",Luxury King Room,0.7 miles from downtown,,$357,,,,,,,,,
2025-10-08,booking.com,2.0,2025-10-10,2025-10-13,"Delta Suites - In Downtown Toronto, Opposite Scotiabank Arena, CN Tower, Rogers Centre & MTCC","Entertainment District, Toronto (Entertainment District)",One-Bedroom Apartment,0.6 miles from downtown,,$250,,,,,,,,,
2025-10-08,booking.com,2.0,2025-10-10,2025-10-13,Hilton Toronto,"Financial District, Toronto (Financial District)",Deluxe King Room,0.2 miles from downtown,,$226,,,,,,,,,
2025-10-08,booking.com,2.0,2025-10-10,2025-10-13,Holiday Inn Express Toronto Downtown by IHG,"Old Town Toronto, Toronto (Old Town Toronto)",Standard King Room with Extra Space,0.5 miles from downtown,,$269,,,,,,,,,
2025-10-08,booking.com,2.0,2025-10-10,2025-10-13,Crowne Plaza Toronto Airport by IHG,"Etobicoke, Toronto",Standard Room,10.5 miles from downtown,,$127,,,,,,,,,
2025-10-08,booking.com,2.0,2025-10-10,2025-10-13,Novotel Toronto North York,"North York, Toronto",Superior King Room,8.2 miles from downtown,,$176,,,,,,,,,
2025-10-08,booking.com,2.0,2025-10-10,2025-10-13,Holiday Inn Toronto Downtown Centre by IHG,"The Village, Toronto (The Village)",Premium King Room,0.7 miles from downtown,,$217,,,,,,,,,
2025-10-08,booking.com,2.0,2025-10-10,2025-10-13,Canopy By Hilton Toronto Yorkville,"Downtown Toronto, Toronto",King Room,1.4 miles from downtown,,$314,,,,,,,,,
2025-10-08,booking.com,2.0,2025-10-10,2025-10-13,"Doubletree by Hilton Toronto Airport, ON","Etobicoke, Toronto (Northeast Mississauga)",Queen Room with Two Queen Beds,11 miles from downtown,,$154,,,,,,,,,
2025-10-08,booking.com,2.0,2025-10-10,2025-10-13,Woodbine Hotel & Suites,"Etobicoke, Toronto",Queen Room,11.3 miles from downtown,,$129,,,,,,,,,
2025-10-08,booking.com,2.0,2025-10-10,2025-10-13,Delta Hotels by Marriott Toronto Airport & Conference Centre,"Etobicoke, Toronto",Double Queen Room,10.2 miles from downtown,,$152,,,,,,,,,
2025-10-08,booking.com,2.0,2025-10-10,2025-10-13,Hyatt Regency Toronto,"Entertainment District, Toronto (Entertainment District)",Queen Room,0.6 miles from downtown,,$238,,,,,,,,,
2025-10-08,booking.com,2.0,2025-10-10,2025-10-13,Breezy Lake And City Views - One Free Underground Parking,"Downtown Toronto, Toronto",Two-Bedroom Apartment,1.1 miles from downtown,,$167,,,,,,,,,
2025-10-08,booking.com,2.0,2025-10-10,2025-10-13,Holiday Inn Express & Suites Toronto Airport South by IHG,"Etobicoke, Toronto (Northeast Mississauga)",Standard Room with Two Queen Beds,10.5 miles from downtown,,$164,,,,,,,,,
2025-10-08,booking.com,2.0,2025-10-10,2025-10-13,"Revery Toronto Downtown, Curio Collection by Hilton","Entertainment District, Toronto (Entertainment District)",King Room,0.6 miles from downtown,,$267,,,,,,,,,
2025-10-08,booking.com,2.0,2025-10-10,2025-10-13,Hampton Inn & Suites by Hilton Toronto Downtown,"The Village, Toronto (The Village)",King Room,0.7 miles from downtown,,$242,,,,,,,,,
2025-10-08,booking.com,2.0,2025-10-10,2025-10-13,Holiday Inn Toronto Airport East by IHG,"Etobicoke, Toronto",Standard King Room,9.9 miles from downtown,,$137,,,,,,,,,
2025-10-08,booking.com,2.0,2025-10-10,2025-10-13,W Toronto,"Bloor-Yorkville, Toronto (Bloor-Yorkville)",Deluxe King Room,1.3 miles from downtown,,$244,,,,,,,,,
2025-10-08,booking.com,2.0,2025-10-10,2025-10-13,Courtyard by Marriott Toronto Airport,"Etobicoke, Toronto (Northeast Mississauga)",Queen Room with Two Queen Beds,10.9 miles from downtown,,$145,,,,,,,,,
2025-10-08,booking.com,2.0,2025-10-10,2025-10-13,Parc Suites - Entertainment District Toronto,"Entertainment District, Toronto (Entertainment District)",One-Bedroom Apartment,0.4 miles from downtown,,$250,,,,,,,,,
2025-10-08,booking.com,2.0,2025-10-10,2025-10-13,Union Hotel,"Financial District, Toronto (Financial District)",King Room,0.4 miles from downtown,,$190,,,,,,,,,
2025-10-08,booking.com,2.0,2025-10-10,2025-10-13,Deluxe Suites at York,"Entertainment District, Toronto (Entertainment District)",One-Bedroom Apartment with City View,0.7 miles from downtown,Late Escape Deal,$203,,,,,,,,,
2025-10-08,booking.com,2.0,2025-10-10,2025-10-13,Toronto Marriott City Centre Hotel,"Entertainment District, Toronto (Entertainment District)","Guest room, 1 Queen",0.8 miles from downtown,,$345,,,,,,,,,
2025-10-08,booking.com,2.0,2025-10-10,2025-10-13,Ace Hotel Toronto,"Fashion District, Toronto (Fashion District)",Queen Room,0.9 miles from downtown,,$296,,,,,,,,,
2025-10-08,booking.com,2.0,2025-10-10,2025-10-13,Toronto Don Valley Hotel and Suites,"North York, Toronto",King Room,5.7 miles from downtown,,$136,,,,,,,,,
2025-10-08,booking.com,2.0,2025-10-10,2025-10-13,586 Hotel,"Kensington Market, Toronto (Kensington Market)",Double Room,0.9 miles from downtown,,$99,,,,,,,,,
2025-10-08,booking.com,2.0,2025-10-10,2025-10-13,Warm Downtown Home,"Old Town Toronto, Toronto (Old Town Toronto)",Standard Double Room,0.5 miles from downtown,,$123,,,,,,,,,
2025-10-08,booking.com,2.0,2025-10-10,2025-10-13,"The Anndore House, part of JDV by Hyatt","The Village, Toronto (The Village)",King Loft,1.2 miles from downtown,,$291,,,,,,,,,
2025-10-08,booking.com,2.0,2025-10-10,2025-10-13,Le Germain Hotel Toronto,"Entertainment District, Toronto (Entertainment District)",Classic Queen Room,0.6 miles from downtown,,$294,,,,,,,,,
2025-10-08,booking.com,2.0,2025-10-10,2025-10-13,Comfort Inn & Conference Centre Toronto Airport,"Etobicoke, Toronto",Standard King Room,10.7 miles from downtown,,$87,,,,,,,,,
2025-10-08,booking.com,2.0,2025-10-10,2025-10-13,"The Westin Harbour Castle, Toronto","The Harbourfront, Toronto (The Harbourfront)","Guest room, 1 King, Lake view",0.8 miles from downtown,,$240,,,,,,,,,
2025-10-08,booking.com,2.0,2025-10-10,2025-10-13,B Hotel,Toronto,Deluxe Suite,2.7 miles from downtown,,$167,,,,,,,,,
2025-10-08,booking.com,2.0,2025-10-10,2025-10-13,Falstaff Home,Toronto,Double Room,7.3 miles from downtown,Late Escape Deal,$70,,,,,,,,,
2025-10-08,booking.com,2.0,2025-10-10,2025-10-13,1 Hotel Toronto,"Fashion District, Toronto (Fashion District)",Studio King,1.2 miles from downtown,,$356,,,,,,,,,
2025-10-08,booking.com,2.0,2025-10-10,2025-10-13,EST Hotel,"Etobicoke, Toronto",Standard King Bed,13 miles from downtown,,$104,,,,,,,,,
2025-10-08,booking.com,2.0,2025-10-10,2025-10-13,Sheraton Toronto Airport Hotel & Conference Centre,"Etobicoke, Toronto","Traditional, Guest room, 2 Queen",10.5 miles from downtown,,$164,,,,,,,,,
2025-10-08,booking.com,2.0,2025-10-10,2025-10-13,Modern Private Room Private Bathroom with King Bed with TV and Optional Balcony 10 minutes to Rogers Stadium Midtown Downtown Toronto,"North York, Toronto",Triple Room with Private Bathroom,7.5 miles from downtown,,$110,,,,,,,,,
2025-10-08,booking.com,2.0,2025-10-10,2025-10-13,Stay Inn Hotel Toronto,"Etobicoke, Toronto",Business King Room - Fully Renovated 2021,8.6 miles from downtown,,$156,,,,,,,,,
2025-10-08,booking.com,2.0,2025-10-10,2025-10-13,Super 8 by Wyndham Toronto East ON,"Scarborough, Toronto",Queen Room - Non-Smoking,9.7 miles from downtown,,$87,,,,,,,,,
2025-10-08,booking.com,2.0,2025-10-10,2025-10-13,Dream Catcher Travel House,Toronto,Double Room with Private Bathroom,2 miles from downtown,,$88,,,,,,,,,
2025-10-08,booking.com,2.0,2025-10-10,2025-10-13,Toronto Travellers Home,"Kensington Market, Toronto (Kensington Market)",Double Room,0.9 miles from downtown,,$94,,,,,,,,,
2025-10-08,booking.com,2.0,2025-10-10,2025-10-13,Nox Hostel,"Downtown Toronto, Toronto",Twin Room with Shared Bathroom,1.3 miles from downtown,Late Escape Deal,$83,,,,,,,,,
2025-10-08,booking.com,2.0,2025-10-10,2025-10-13,Courtyard by Marriott Toronto Downtown,"The Village, Toronto (The Village)",King Room with City View,0.8 miles from downtown,,$231,,,,,,,,,
2025-10-08,booking.com,2.0,2025-10-10,2025-10-13,"The Ellios Suites - In Downtown Toronto, Opposite CN Tower & Rogers Centre","Entertainment District, Toronto (Entertainment District)",One-Bedroom Apartment,0.7 miles from downtown,,$250,,,,,,,,,
2025-10-08,booking.com,2.0,2025-10-10,2025-10-13,Hotel Victoria,"Financial District, Toronto (Financial District)",Business Queen Room,0.3 miles from downtown,,$193,,,,,,,,,
2025-10-08,booking.com,2.0,2025-10-10,2025-10-13,The Westin Toronto Airport,"Etobicoke, Toronto (Northeast Mississauga)","Traditional, Guest room, 1 King",11.1 miles from downtown,,$159,,,,,,,,,
2025-10-08,booking.com,2.0,2025-10-10,2025-10-13,Dragon Gate Inn,"Downtown Toronto, Toronto",Deluxe Suite with Two Queen Beds,1.3 miles from downtown,,$143,,,,,,,,,
2025-10-08,booking.com,2.0,2025-10-10,2025-10-13,Pantages Hotel Toronto Centre,"Yonge - Dundas, Toronto (Yonge - Dundas)",City King Room,0.2 miles from downtown,,$243,,,,,,,,,
2025-10-08,booking.com,2.0,2025-10-10,2025-10-13,The Westlake,"Etobicoke, Toronto",Queen Suite,7 miles from downtown,,$205,,,,,,,,,
2025-10-08,booking.com,2.0,2025-10-10,2025-10-13,Modern Toronto Lake View & CN Tower View - One Free Parking,"The Harbourfront, Toronto (Entertainment District)",Two-Bedroom Apartment,0.6 miles from downtown,,$201,,,,,,,,,
2025-10-08,booking.com,2.0,2025-10-10,2025-10-13,Yorkville Condo near STK,"Bloor-Yorkville, Toronto (Bloor-Yorkville)",One-Bedroom Apartment with Garden View,1.4 miles from downtown,,$168,,,,,,,,,
2025-10-08,booking.com,2.0,2025-10-10,2025-10-13,freed Suites - Downtown Toronto,"Entertainment District, Toronto (Entertainment District)",Two-Bedroom Apartment with Balcony,0.4 miles from downtown,,$334,,,,,,,,,
2025-10-08,booking.com,2.0,2025-10-10,2025-10-13,Luxury Basement-Private Bdr & Bathroom with free parking In Toronto,"Etobicoke, Toronto",Superior Queen Room,12.5 miles from downtown,,$57,,,,,,,,,
2025-10-08,booking.com,2.0,2025-10-10,2025-10-13,Downtown Toronto 2 bedrooms with parking,"Entertainment District, Toronto (Entertainment District)",Two-Bedroom Apartment with Balcony,0.7 miles from downtown,Late Escape Deal,$215,,,,,,,,,
2025-10-08,booking.com,2.0,2025-10-10,2025-10-13,Best Western Plus Toronto North York Hotel & Suites,"North York, Toronto",Queen Room,10.3 miles from downtown,,$134,,,,,,,,,
2025-10-08,booking.com,2.0,2025-10-10,2025-10-13,"Toor Hotel Toronto, Part Of Jdv By Hyatt","Downtown Toronto, Toronto",King Room,0.5 miles from downtown,,$225,,,,,,,,,
2025-10-08,booking.com,2.0,2025-10-10,2025-10-13,Residence Inn by Marriott Toronto Airport,"Etobicoke, Toronto",King or Queen Suite with Sofa Bed,10.6 miles from downtown,,$169,,,,,,,,,
2025-10-08,booking.com,2.0,2025-10-10,2025-10-13,Delta Hotels by Marriott Toronto,"Entertainment District, Toronto (Entertainment District)",Queen Room with Two Queen Beds,0.7 miles from downtown,,$274,,,,,,,,,
2025-10-08,booking.com,2.0,2025-10-10,2025-10-13,Nobu Suites - Toronto's Entertainment District,"Entertainment District, Toronto (Entertainment District)",Two-Bedroom Apartment,0.4 miles from downtown,,$308,,,,,,,,,
2025-10-08,booking.com,2.0,2025-10-10,2025-10-13,The Hazelton Hotel,"Bloor-Yorkville, Toronto (Bloor-Yorkville)","Luxry Room, 1 King Bed",1.4 miles from downtown,,"$1,013",,,,,,,,,
2025-10-08,booking.com,2.0,2025-10-10,2025-10-13,Deluxe Inn,"Etobicoke, Toronto",Queen Room - Non-Smoking,8.2 miles from downtown,,$91,,,,,,,,,
2025-10-08,booking.com,2.0,2025-10-10,2025-10-13,Sutton Place Hotel Toronto,"Entertainment District, Toronto (Entertainment District)",Accessible Room - 1 King Bed,0.7 miles from downtown,,$218,,,,,,,,,
2025-10-08,booking.com,2.0,2025-10-10,2025-10-13,Yonge Suites Apart Hotel,"Yonge - Dundas, Toronto (Yonge Street)",One-Bedroom Apartment with Partial City View,0.2 miles from downtown,,$197,,,,,,,,,
2025-10-08,booking.com,2.0,2025-10-10,2025-10-13,TononHouse,"North York, Toronto",Queen Room,9.2 miles from downtown,Late Escape Deal,$69,,,,,,,,,
2025-10-08,booking.com,2.0,2025-10-10,2025-10-13,"Large Downtown 2Br condo with Parking steps to Eaton Centre, UofT and SickKids","Downtown Toronto, Toronto",Two-Bedroom Apartment,0.6 miles from downtown,,$253,,,,,,,,,
2025-10-08,booking.com,2.0,2025-10-10,2025-10-13,The Alexandra Hotel,"Downtown Toronto, Toronto",Double and Single Bed Room,1 miles from downtown,,$128,,,,,,,,,
2025-10-08,booking.com,2.0,2025-10-10,2025-10-13,Park Hyatt Toronto,"The Annex, Toronto (The Annex)",One-Bedroom Suite,1.4 miles from downtown,,$631,,,,,,,,,
2025-10-08,booking.com,2.0,2025-10-10,2025-10-13,Luxurious Suite in Yorkville,"Bloor-Yorkville, Toronto (Bloor-Yorkville)",Two-Bedroom Apartment,1.4 miles from downtown,,$189,,,,,,,,,
2025-10-08,booking.com,2.0,2025-10-10,2025-10-13,Marriott Downtown at CF Toronto Eaton Centre,"Yonge - Dundas, Toronto (Yonge - Dundas)","Guest room, 2 Double",0.2 miles from downtown,,$250,,,,,,,,,
2025-10-08,booking.com,2.0,2025-10-10,2025-10-13,Best Western Premier Toronto Airport Carlingview Hotel,"Etobicoke, Toronto (Northeast Mississauga)",King Room - Non-Smoking/Shower Only,10.7 miles from downtown,,$100,,,,,,,,,
2025-10-08,booking.com,2.0,2025-10-10,2025-10-13,Best Western Plus Travel Hotel Toronto Airport,Toronto,Queen Room,10.9 miles from downtown,,$100,,,,,,,,,
2025-10-08,booking.com,2.0,2025-10-10,2025-10-13,Holiday Inn Express Toronto-North York by IHG,"North York, Toronto",Standard King Room,10.2 miles from downtown,,$153,,,,,,,,,
2025-10-08,booking.com,2.0,2025-10-10,2025-10-13,La TUMU,"The Village, Toronto (The Village)",Deluxe Studio,0.9 miles from downtown,,$197,,,,,,,,,
2025-10-08,booking.com,2.0,2025-10-10,2025-10-13,Condo Downtown Toronto with free parking,"Downtown Toronto, Toronto",Two-Bedroom Apartment,1.1 miles from downtown,,$182,,,,,,,,,
2025-10-08,booking.com,2.0,2025-10-10,2025-10-13,Gladstone House,"West Queen West, Toronto (West Queen West)",Studio Queen,2.3 miles from downtown,,$279,,,,,,,,,
2025-10-08,booking.com,2.0,2025-10-10,2025-10-13,Stylish Condo Downtown Near CN Tower - Free parking,"Downtown Toronto, Toronto",One-Bedroom Apartment,1.1 miles from downtown,,$261,,,,,,,,,
2025-10-08,booking.com,2.0,2025-10-10,2025-10-13,Chic 1-BR Condo; Parking included; Downtown Core,"Entertainment District, Toronto (Entertainment District)",One-Bedroom Apartment,0.7 miles from downtown,,$366,,,,,,,,,
2025-10-08,booking.com,2.0,2025-10-10,2025-10-13,Gorgeous Condo in Downtown Near CN Tower,"Entertainment District, Toronto (Entertainment District)",One-Bedroom Apartment,0.6 miles from downtown,,$177,,,,,,,,,
2025-10-08,booking.com,2.0,2025-10-10,2025-10-13,Xiao Wang,"The Annex, Toronto (The Annex)",Queen Room with Garden View,1.6 miles from downtown,,$250,,,,,,,,,
2025-10-08,booking.com,2.0,2025-10-10,2025-10-13,Le Germain Hotel Maple Leaf Square,"Entertainment District, Toronto (Entertainment District)",Classic King Room,0.6 miles from downtown,,$284,,,,,,,,,
2025-10-08,booking.com,2.0,2025-10-10,2025-10-13,Stylish Condos Toronto,"Entertainment District, Toronto (Entertainment District)",Two-Bedroom Apartment,0.7 miles from downtown,,$303,,,,,,,,,
2025-10-08,booking.com,2.0,2025-10-10,2025-10-13,Downtown Luxury Victorian Retreat,"Cabbagetown, Toronto (Cabbagetown)",Deluxe Queen Room with Garden View,0.8 miles from downtown,,$244,,,,,,,,,
2025-10-08,booking.com,2.0,2025-10-10,2025-10-13,The Yorkville Royal Sonesta Hotel Toronto,"The Annex, Toronto (The Annex)",Deluxe Room with Two Queen Beds,1.3 miles from downtown,,$231,,,,,,,,,
2025-10-08,booking.com,2.0,2025-10-10,2025-10-13,Montecassino Hotel & Event Centre,"North York, Toronto",Run Of The House,8.6 miles from downtown,,$154,,,,,,,,,
2025-10-08,booking.com,2.0,2025-10-10,2025-10-13,Residence Inn by Marriott Toronto Downtown / Entertainment District,"Entertainment District, Toronto (Entertainment District)",King Studio with Sofa Bed,0.7 miles from downtown,,$269,,,,,,,,,
2025-10-08,booking.com,2.0,2025-10-10,2025-10-13,Carlton House,"Cabbagetown, Toronto (Cabbagetown)",Queen Room,1.3 miles from downtown,,$102,,,,,,,,,
2025-10-08,booking.com,2.0,2025-10-10,2025-10-13,"Elegant 2BR & 2BA Retreat in Prime Yorkville, Downtown","Bloor-Yorkville, Toronto (Bloor-Yorkville)",Two-Bedroom Apartment with City View,1.4 miles from downtown,,$266,,,,,,,,,
2025-10-08,booking.com,2.0,2025-10-10,2025-10-13,Two BD CN Tower and Lake Ontario View,"Entertainment District, Toronto (Entertainment District)",Two-Bedroom Apartment,0.7 miles from downtown,,$347,,,,,,,,,
2025-10-08,booking.com,2.0,2025-10-10,2025-10-13,Beautiful Modern Toronto Luxurious Scotiabank Arena,"Entertainment District, Toronto (Entertainment District)",Apartment with Lake View,0.6 miles from downtown,,$532,,,,,,,,,
2025-10-08,booking.com,2.0,2025-10-10,2025-10-13,"BISHA, a Luxury Collection Hotel, Toronto","Entertainment District, Toronto (Entertainment District)",The Nina King Room with City View,0.7 miles from downtown,,$377,,,,,,,,,
2025-10-08,booking.com,2.0,2025-10-10,2025-10-13,Lilen's Home,"Scarborough, Toronto",Family Room with Private Bathroom,8.2 miles from downtown,,$181,,,,,,,,,
2025-10-08,booking.com,2.0,2025-10-10,2025-10-13,"Toronto Downtown Core Two Bedroom Condo with CN Tower View, Free Parking","Entertainment District, Toronto (Entertainment District)",Two-Bedroom Apartment with City View,0.6 miles from downtown,,$226,,,,,,,,,
2025-10-08,booking.com,2.0,2025-10-10,2025-10-13,Toronto Airport Marriott Hotel,"Etobicoke, Toronto",King Room,10.8 miles from downtown,,$155,,,,,,,,,
2025-10-08,booking.com,2.0,2025-10-10,2025-10-13,Filmores Hotel,"Downtown Toronto, Toronto",Queen Room,0.6 miles from downtown,,$153,,,,,,,,,
2025-10-08,booking.com,2.0,2025-10-10,2025-10-13,Toronto Bloor & Yonge Luxury Condo,"The Village, Toronto (The Village)",One-Bedroom Apartment,1 miles from downtown,,$193,,,,,,,,,
2025-10-08,booking.com,2.0,2025-10-10,2025-10-13,Relax in East York Space Share,Toronto,Bungalow,3.5 miles from downtown,,$115,,,,,,,,,
2025-10-08,booking.com,2.0,2025-10-10,2025-10-13,The Broadview Hotel,Toronto,King Room,1.7 miles from downtown,,$326,,,,,,,,,
2025-10-08,booking.com,2.0,2025-10-10,2025-10-13,Bedroom in Corso Italia Neighborhood,Toronto,Apartment,4.1 miles from downtown,,$94,,,,,,,,,
2025-10-08,booking.com,2.0,2025-10-10,2025-10-13,Private Rooms in House in North York Shared Kitchen,"North York, Toronto",Double Room with Shared Bathroom,10.4 miles from downtown,,$60,,,,,,,,,
2025-10-08,booking.com,2.0,2025-10-10,2025-10-13,Designer One Bedroom Suite - Entertainment District Toronto,"Entertainment District, Toronto (Entertainment District)",One-Bedroom Apartment,0.4 miles from downtown,,$250,,,,,,,,,
2025-10-08,booking.com,2.0,2025-10-10,2025-10-13,Simple & Tidy Private Rooms,"Scarborough, Toronto",Standard Double Room with Shared Bathroom,11 miles from downtown,,$71,,,,,,,,,
2025-10-08,booking.com,2.0,2025-10-10,2025-10-13,Idlewood Inn,"Scarborough, Toronto",Suite,11.9 miles from downtown,,$90,,,,,,,,,
2025-10-08,booking.com,2.0,2025-10-10,2025-10-13,"CN Tower View with Free Parking, Pool, Gym, Free Skating, and More","Downtown Toronto, Toronto",One-Bedroom Apartment,1.5 miles from downtown,,$212,,,,,,,,,
2025-10-08,booking.com,2.0,2025-10-10,2025-10-13,SoHo Residences Toronto,"Entertainment District, Toronto (Entertainment District)",Studio Apartment,0.7 miles from downtown,,$359,,,,,,,,,
2025-10-08,booking.com,2.0,2025-10-10,2025-10-13,Casa Hotel Stylish Suite with Patio in Leslieville,"Leslieville, Toronto (Leslieville)",Suite,2.9 miles from downtown,,$123,,,,,,,,,
2025-10-08,booking.com,2.0,2025-10-10,2025-10-13,Discounted Elegant Yorkville Suite,"Bloor-Yorkville, Toronto (Bloor-Yorkville)",One-Bedroom Apartment,1.4 miles from downtown,,$204,,,,,,,,,
2025-10-08,booking.com,2.0,2025-10-10,2025-10-13,Nobu Hotel Toronto,"Entertainment District, Toronto (Entertainment District)",Deluxe King Room,0.6 miles from downtown,,$679,,,,,,,,,
2025-10-08,booking.com,2.0,2025-10-10,2025-10-13,Super Cosy Peaceful room with Garden view free Parking,"Etobicoke, Toronto",Double Room with Garden View,9.7 miles from downtown,,$52,,,,,,,,,
2025-10-08,booking.com,2.0,2025-10-10,2025-10-13,"The Ritz-Carlton, Toronto","Entertainment District, Toronto (Entertainment District)",Lake Ontario View Room - 2 Queen beds,0.5 miles from downtown,,$622,,,,,,,,,
2025-10-08,booking.com,2.0,2025-10-10,2025-10-13,Magnificient View next CN Tower/Rogers/Union/MTCC,"Entertainment District, Toronto (Entertainment District)",One-Bedroom Apartment,0.7 miles from downtown,,$194,,,,,,,,,
2025-10-08,booking.com,2.0,2025-10-10,2025-10-13,3 BR House in Toronto Downtown,Toronto,Apartment,3 miles from downtown,,$305,,,,,,,,,
2025-10-08,booking.com,2.0,2025-10-10,2025-10-13,132 Chatham ave,Toronto,One-Bedroom Apartment,3 miles from downtown,,$123,,,,,,,,,
2025-10-08,booking.com,2.0,2025-10-10,2025-10-13,Toronto GREAT Located,Toronto,Double Room,3.2 miles from downtown,,$89,,,,,,,,,
2025-10-08,booking.com,2.0,2025-10-10,2025-10-13,Mins from Toronto Downtown UFT Exhibition Place,Toronto,Two-Bedroom Apartment,2.9 miles from downtown,,$243,,,,,,,,,
2025-10-08,booking.com,2.0,2025-10-10,2025-10-13,Comfort Home Toronto,"Scarborough, Toronto",Standard Queen Room,8.5 miles from downtown,,$90,,,,,,,,,
2025-10-08,booking.com,2.0,2025-10-10,2025-10-13,Cozy 1 BR & Den Condo in North York Free Parking,"North York, Toronto",One-Bedroom Apartment,7.6 miles from downtown,Late Escape Deal,$134,,,,,,,,,
